6,4,,,39804,Chiyu Jiang; Chiyu Jiang; Lawrence Evans,,Mathematics,54,002,B,Letter Grade,B-,Lin Alg & Diff
6,4,,,39808,Kyle Miller; Kyle Miller; Lawrence Evans,,Mathematics,54,003,B,Letter Grade,B-,Lin Alg & Diff
6,3,,,39812,Lawrence Evans; Ruochen Liang; Ruochen Liang,,Mathematics,54,004,B,Letter Grade,B-,Lin Alg & Diff
6,1,,,39816,Lawrence Evans; Onyebuchi Ekenta; Onyebuchi Ekenta,,Mathematics,54,005,B,Letter Grade,B-,Lin Alg & Diff
6,1,,,39824,Lawrence Evans; Michael Klug; Michael Klug,,Mathematics,54,007,B,Letter Grade,B-,Lin Alg & Diff
6,4,,,39828,Doosung Park; Doosung Park; Lawrence Evans,,Mathematics,54,008,B,Letter Grade,B-,Lin Alg & Diff
6,6,,,39832,Benjamin Castle; Benjamin Castle; Lawrence Evans,,Mathematics,55,001,B,Letter Grade,B-,Discrete Math
6,2,,,39836,Derek Hollowood; Derek Hollowood; Lawrence Evans,,Mathematics,55,002,B,Letter Grade,B-,Discrete Math
6,3,,,39840,Arash Farahmand,,Mathematics,55,003,B,Letter Grade,B-,Discrete Math
6,2,,,39844,Michael Wong; Michael Wong,,Mathematics,96,001,B,Letter Grade,B-,College Algebra
6,5,,,39896,Michael Pejic; Michael Pejic,,Mathematics,104,002,B,Letter Grade,B-,Intro To Analysis
6,6,,,39900,Khalilah Beal; Khalilah Beal,,Mathematics,104,003,B,Letter Grade,B-,Intro To Analysis
6,4,,,39904,Kai-Chieh Chen; Kai-Chieh Chen; Lawrence Evans,,Mathematics,110,001,B,Letter Grade,B-,Linear Algebra
6,5,,,39908,Brandon Williams; Brandon Williams; Lawrence Evans,,Mathematics,110,002,B,Letter Grade,B-,Linear Algebra
6,4,,,39912,James Mcivor; James Mcivor; Lawrence Evans,,Mathematics,113,001,B,Letter Grade,B-,Abstract Algebra
6,2,,,39916,Jesse Elliott; Jesse Elliott,,Mathematics,113,002,B,Letter Grade,B-,Abstract Algebra
6,4,,,39920,Lawrence Evans; Shiyu Li; Shiyu Li,,Mathematics,115,001,B,Letter Grade,B-,Intro Number Theory
6,3,,,39924,Kevin O'Neill; Kevin Oneill; Lawrence Evans,,Mathematics,126,001,B,Letter Grade,B-,Intro Part Dif Equa
6,4,,,39926,John Strain; John Strain,,Mathematics,128A,001,B,Letter Grade,B-,Numerical Analysis
6,4,,,39930,Chen Shen; Chen Shen; Lawrence Evans,,Mathematics,128A,002,B,Letter Grade,B-,Numerical Analysis
6,3,,,39934,Lawrence Evans; Samuel Ramsey; Samuel Ramsey,,Mathematics,185,001,B,Letter Grade,B-,Complex Analysis
6,1,,,39938,Albert Ai; Albert Ai; Lawrence Evans,,Mathematics,185,002,B,Letter Grade,B-,Complex Analysis
6,1,,,40136,James Robertson; James Robertson; Lawrence Evans,,Mathematics,10A,001,B,Letter Grade,B-,Methods Of Math
6,10,,,40502,Christopher Dames; Christopher Dames; Miguel Sierra Aznar; Miguel Sierra Aznar,,Mechanical Engineering,40,001,B,Letter Grade,B-,Thermodynamics
6,5,,,40506,Sanjay Govindjee,,Mechanical Engineering,W85,001,B,Letter Grade,B-,Intro Solid Mechn
6,7,,,40520,Oliver O'Reilly,,Mechanical Engineering,104,001,B,Letter Grade,B-,Engr Mechanics Ii
6,3,,,40524,Jocelyn Bale-Glickman; Jocelyn Bale-Glickman,,Mechanical Engineering,106,001,B,Letter Grade,B-,Fluid Mechanics
6,3,,,40534,David Rich; David Rich,,Mechanical Engineering,109,001,B,Letter Grade,B-,Heat Transfer
6,1,,,40538,Mark Martin,,Mechanical Engineering,110,001,B,Letter Grade,B-,Intro Product Dev
6,9,,,41402,Josh Jackson,,Media Studies,N10,001,B,Letter Grade,B-,Intro To Mediast
6,2,,,42702,Robin Ball; Robin Ball,,Molecular & Cell Biology,32,001,B,Letter Grade,B-,Intro Human Physi
6,2,,,42708,Robin Ball; Robin Ball,,Molecular & Cell Biology,32L,001,B,Letter Grade,B-,Int Human Phys La
6,12,,,42714,David Presti,,Molecular & Cell Biology,W61,001,B,Letter Grade,B-,Brain Mind Behavi
6,6,,,42716,David Larue,,Molecular & Cell Biology,63,001,B,Letter Grade,B-,Intro Funct Neuro
6,10,,,42718,Natalia Caporale; Natalia Caporale,,Molecular & Cell Biology,C64,001,B,Letter Grade,B-,Exploring The Bra
6,33,,,42762,Natalia Caporale; Natalia Caporale,,Molecular & Cell Biology,102,001,B,Letter Grade,B-,Surv Biochem &
6,1,,,42786,Kathleen Ryan,,Molecular & Cell Biology,C112,001,B,Letter Grade,B-,Gen Microbiology
6,1,,,42792,Irania Alarcon; Irania Alarcon,,Molecular & Cell Biology,C112L,001,B,Letter Grade,B-,Microbiology Lab
6,1,,,43406,Robert Yamasato; Robert Yamasato,,Music,20A,003,B,Letter Grade,B-,Basic Musicianship
6,2,,,43416,Cindy Cox; Elizabeth De Martelly; Elizabeth De Martelly,,Music,N26AC,002,B,Letter Grade,B-,Music In Amer Cul
6,1,,,43418,Edmund Campion,,Music,29,001,B,Letter Grade,B-,Music Now
6,1,,,43444,Cindy Cox; Melanie Gudesblatt; Melanie Gudesblatt,,Music,128T,001,B,Letter Grade,B-,The Amer Musical
6,2,,,43468,Doniel Wilson,,Music,143,001,B,Letter Grade,B-,Gospel Chorus
6,3,,,44120,Diane Pearson,,Native American Studies,151,001,B,Letter Grade,B-,Nat Amer Philos
6,1,,,44510,Carol Redmount; Hassan Rezakhany; Hassan Rezakhany,,Near Eastern Studies,146,001,B,Letter Grade,B-,Islam
6,1,,,45802,Greg Niemeyer; Nicholaus Gutierrez; Nicholaus Gutierrez,,New Media,R1B,001,B,Letter Grade,B-,New Media R&C
6,4,,,46302,Nastaran Faghihnia; Nastaran Faghihnia,,Nutritional Science & Tox,10,001,B,Letter Grade,B-,Intro Human Nutr
6,3,,,47104,Tetsushi Ogata,,Peace & Conflict Studies,127,001,B,Letter Grade,B-,Hr And Global Poli
6,2,,,47302,Dylan Murray; Dylan Murray; Hannah Ginsborg,,Philosophy,2,001,B,Letter Grade,B-,Ind Moral/Soc Just
6,1,,,47306,Daniel Khokhar; Daniel Khokhar; Hannah Ginsborg,,Philosophy,2,002,B,Letter Grade,B-,Ind Moral/Soc Just
6,3,,,47309,Florian Grosser,,Philosophy,2,003,B,Letter Grade,B-,Ind Moral/Soc Just
6,4,,,47314,Adam Bradley; Adam Bradley; Hannah Ginsborg,,Philosophy,3,002,B,Letter Grade,B-,Nature Of Mind
6,1,,,47322,Hannah Ginsborg; Russell Buehler; Russell Buehler,,Philosophy,12A,001,B,Letter Grade,B-,Intro To Logic
6,2,,,47326,Ethan Jerzak; Ethan Jerzak; Hannah Ginsborg,,Philosophy,12A,002,B,Letter Grade,B-,Intro To Logic
6,2,,,47338,Timothy Crockett; Timothy Crockett,,Philosophy,25B,001,B,Letter Grade,B-,Modern Philosophy
6,5,,,47342,Timothy Crockett; Timothy Crockett,,Philosophy,25B,002,B,Letter Grade,B-,Modern Philosophy
6,3,,,47350,Paul Skokowski,,Philosophy,128,001,B,Letter Grade,B-,Phil Of Science
6,2,,,47358,Arpy Khatchirian; Arpy Khatchirian,,Philosophy,135,001,B,Letter Grade,B-,Theory Of Meaning
6,3,,,47362,Klaus Corcilius,,Philosophy,160,001,B,Letter Grade,B-,Plato
6,8,,,48002,Matthias Reinsch; Matthias Reinsch,,Physics,7A,001,B,Letter Grade,B-,Scient Engin Phys
6,8,,,48020,Michael Bloxham,,Physics,7B,001,B,Letter Grade,B-,Scient Engin Phys
6,4,,,48038,Alex Frano Pereira,,Physics,7C,001,B,Letter Grade,B-,Scient Engin Phys
6,13,,,48052,William Golightly; William Golightly,,Physics,8A,001,B,Letter Grade,B-,Intro Physics
6,5,,,48090,Terrence Buehler; Terrence Buehler,,Physics,8B,001,B,Letter Grade,B-,Intro Physics
6,1,,,48134,Amin Jazaeri,,Physics,77,001,B,Letter Grade,B-,Intro Comp Tech P
6,2,,,48148,Joseph Broz; Joseph Broz; Kevin Hayakawa; Kevin Hayakawa; Matthias Reinsch; Matthias Reinsch; Ryan Smith; Ryan Smith; Seth Hirsh,,Physics,111A,001,B,Letter Grade,B-,Instrumentation L
6,8,,,48152,Charles Wohl,,Physics,137A,001,B,Letter Grade,B-,Quantum Mechanics
6,2,,,48710,Kathleen Ryan,,Plant & Microbial Biology,C112,001,B,Letter Grade,B-,Gen Microbiology
6,1,,,48716,Irania Alarcon; Irania Alarcon,,Plant & Microbial Biology,C112L,001,B,Letter Grade,B-,Microbiology Lab
6,3,,,49202,Stephanie Ballenger; Stephanie Ballenger,,Political Economy,100,001,B,Letter Grade,B-,Theory Of Pol Eco
6,5,,,49204,Fatmir Haskaj,,Political Economy,101,001,B,Letter Grade,B-,Contemp Theo Pol
6,4,,,49602,Eric Schickler; Jacob Grumbach; Jacob Grumbach,,Political Science,N1AC,001,B,Letter Grade,B-,Intro Amer Pol
6,8,,,49612,Eric Schickler; Tara Buss; Tara Buss,,Political Science,2,001,B,Letter Grade,B-,Intro Comparat Po
6,1,,,49622,Andrew Bertoli; Andrew Bertoli; Eric Schickler,,Political Science,3,001,B,Letter Grade,B-,Empirical Analysi
6,1,,,49642,Eric Schickler; Geoffrey Upton; Geoffrey Upton,,Political Science,116U,001,B,Letter Grade,B-,Topics Pol Theory
6,2,,,49652,Andrew Bertoli; Andrew Bertoli; Eric Schickler,,Political Science,123B,001,B,Letter Grade,B-,Topics Intntl Rel
6,2,,,49662,Michael Fish,,Political Science,129B,001,B,Letter Grade,B-,Russia After Comm
6,7,,,49672,Sean Gailmard,,Political Science,W135,001,B,Letter Grade,B-,Game Theory
6,2,,,49692,Mahmood Monshipouri,,Political Science,142A,001,B,Letter Grade,B-,Middle East Pol
6,10,,,49702,Pradeep Chhibber,,Political Science,W145A,001,B,Letter Grade,B-,Poli Dev India
6,1,,,49716,Eric Schickler; Susan Ostermann; Susan Ostermann,,Political Science,150,001,B,Letter Grade,B-,Amer Legal System
6,7,,,50202,Davina Chan; Davina Chan,,Psychology,N1,001,B,Letter Grade,B-,General Psychology
6,13,,,50204,John Kihlstrom,,Psychology,W1,001,B,Letter Grade,B-,General Psychology
6,8,,,50206,Robin Ball; Robin Ball,,Psychology,3,001,B,Letter Grade,B-,How The Brain Works
6,15,,,50208,Christopher Gade; Christopher Gade,,Psychology,6,001,B,Letter Grade,B-,Stress And Coping
6,8,,,50210,Arman Catterson; Arman Catterson,,Psychology,7,001,B,Letter Grade,B-,Person In Big Data
6,1,,,50212,Arman Catterson; Arman Catterson,,Psychology,10,001,B,Letter Grade,B-,Res & Data Anal
6,4,,,50258,Natalia Caporale; Natalia Caporale,,Psychology,C64,001,B,Letter Grade,B-,Exploring The Brain
6,4,,,50292,Davina Chan; Davina Chan,,Psychology,N110,001,B,Letter Grade,B-,Introd Biol Psych
6,1,,,50296,James Mc Hale; James Mchale,,Psychology,N130,001,B,Letter Grade,B-,Clinical Psychology
6,4,,,50298,Aaron Fisher,,Psychology,N134,001,B,Letter Grade,B-,Health Psychology
6,5,,,50300,Ephrem Fernandez,,Psychology,N135,001,B,Letter Grade,B-,Treating Mental Ill
6,5,,,50304,Ephrem Fernandez,,Psychology,139,001,B,Letter Grade,B-,Clinical Case Study
6,2,,,50306,Amy Strage; Amy Strage,,Psychology,N140,001,B,Letter Grade,B-,Development Psych
6,2,,,50308,Amy Cook; Amy Cook,,Psychology,N140,002,B,Letter Grade,B-,Development Psych
6,13,,,50310,Oliver John,,Psychology,N150,001,B,Letter Grade,B-,Personality Psych
6,12,,,50312,Christopher Gade; Christopher Gade,,Psychology,N160,001,B,Letter Grade,B-,Social Psychology
6,8,,,50314,Shreya Sarkar-Barney,,Psychology,N180,001,B,Letter Grade,B-,Indust/Organ Psych
6,4,,,50716,Robin Flagg; Robin Flagg,,Public Health,150D,001,B,Letter Grade,B-,Intro Hlth Pol Mg
6,5,,,50718,Peter Dailey; Peter Dailey,,Public Health,162A,001,B,Letter Grade,B-,Pub Hlth Microbio
6,1,,,50872,Sarah Gamble,,Public Health,107,001,B,Letter Grade,B-,Viol Soc Jst Pb H
6,1,,,51602,Terri-Lynn Tanaka; Terri-Lynn Tanaka,,Religious Studies,C104,001,B,Letter Grade,B-,Babylonian Religi
6,1,,,51806,Dale Carrico; Norman Carrico,,Rhetoric,10,001,B,Letter Grade,B-,Reason And Argument
6,1,,,51824,Jerilyn Sambrooke; Jerilyn Sambrooke; Michael Mascuch; Michael Mascuch,,Rhetoric,156,001,B,Letter Grade,B-,Political Novel
6,1,,,52306,Monica Hidalgo; Monica Hidalgo,,Scandinavian,R5B,102,B,Letter Grade,B-,Reading & Comp
6,2,,,53604,Lyubov Golburt; Lyubov Golburt; Matthew Kendall; Matthew Kendall,,Slavic Languages & Lit,R5B,101,B,Letter Grade,B-,Reading And Comp
6,3,,,54918,Genevieve Graaf; Genevieve Graaf; Hanna Mark; Hanna Mark; Jill Berrick; Jill Duerr,,Social Welfare,112,001,B,Letter Grade,B-,Soc Welfare Polic
6,1,,,54932,Amanda Reiman; Amanda Reiman,,Social Welfare,148,001,B,Letter Grade,B-,Sub Abuse Trmt
6,1,,,55501,Laura Thomson,,Sociology,N1H,001,B,Letter Grade,B-,Intro To Sociology
6,8,,,55502,Kristen Nelson; Kristen Nelson; Michael Burawoy,,Sociology,3AC,001,B,Letter Grade,B-,Prin Soc: Am Cultur
6,2,,,55504,James Lamb; James Lamb; Michael Burawoy,,Sociology,5,001,B,Letter Grade,B-,Eval Of Evidence
6,7,,,55510,Linus Huang; Linus Huang,,Sociology,110,001,B,Letter Grade,B-,Org & Soc Insti
6,2,,,55512,Mario Castillo; Mario Castillo; Michael Burawoy,,Sociology,111AC,001,B,Letter Grade,B-,Socio Of The Family
6,1,,,55514,Matteo Bortolini,,Sociology,C112,001,B,Letter Grade,B-,Sociology Religion
6,2,,,55517,Joshua Seim; Joshua Seim; Michael Burawoy,,Sociology,C115,001,B,Letter Grade,B-,Soc Of Hlth & M
6,3,,,55520,Andrew Barlow,,Sociology,131AC,001,B,Letter Grade,B-,Race/Eth Rel:Am Cul
6,1,,,55522,Laleh Behbehanian; Laleh Behbehanian,,Sociology,140,001,B,Letter Grade,B-,Polit & Soc Cha
6,1,,,55526,Matthew Rowe; Matthew Rowe; Michael Burawoy,,Sociology,160,001,B,Letter Grade,B-,Sociol Of Culture
6,2,,,55530,Edwin Ackerman; Edwin Ackerman; Michael Burawoy,,Sociology,190,001,B,Letter Grade,B-,Sem & Res In So
6,1,,,56204,Padma Maitland; Padma Maitland; Robert Goldman,,South Asian,R5A,002,B,Letter Grade,B-,Great Books India
6,1,,,58204,Caterina Riley; Caterina Riley; Miriam Hernandez-Rodriguez,,Spanish,1,002,B,Letter Grade,B-,Elem Spanish
6,2,,,58207,Azucena Hernandez-Ramirez; Azucena Hernandez-Ramirez; Miriam Hernandez-Rodriguez,,Spanish,3,001,B,Letter Grade,B-,Intermed Spanish
6,3,,,58210,Daniel Rodriguez; Daniel Rodriguez; Miriam Hernandez-Rodriguez,,Spanish,4,001,B,Letter Grade,B-,Intermed Spanish
6,3,,,58712,Seema Singh Saharan,,Statistics,2,001,B,Letter Grade,B-,Intro To Stat
6,5,,,58720,Fletcher Ibser; Fletcher Ibser,,Statistics,20,001,B,Letter Grade,B-,Intro Prob Stat Cal
6,30,,,58726,Fletcher Ibser; Fletcher Ibser,,Statistics,W21,001,B,Letter Grade,B-,Intro Prob Stat Bus
6,1,,,58738,Michael Jordan; Thanh-Nhan Do; Thanh-Nhan Do,,Statistics,133,001,B,Letter Grade,B-,Computing Data
6,5,,,58742,Michael Jordan; Wenpin Tang; Wenpin Tang,,Statistics,134,001,B,Letter Grade,B-,Concepts Of Prob
6,4,,,58750,Seema Singh Saharan,,Statistics,135,001,B,Letter Grade,B-,Concepts Of Stat
6,15,,,58756,Hyunyoung Choi,,Statistics,155,001,B,Letter Grade,B-,Game Theory
6,1,,,59512,Maureen Tang; Maureen Tang,,Theater Dance & Perf Stds,10,003,B,Letter Grade,B-,Fund. Of Acting I
6,1,,,59516,Jenefer Johnson,,Theater Dance & Perf Stds,52AC,001,B,Letter Grade,B-,Dance In Am Cultu
6,1,,,59803,Jeroen Dewulf,,UGIS-UG Interdisc Studies,W158,001,B,Letter Grade,B-,Global Citizenship
6,1,,,59840,Joel Clark,,UGIS-UG Interdisc Studies,W157,006,B,Letter Grade,B-,Experiential Learn
6,2,,,59854,Joel Clark,,UGIS-UG Interdisc Studies,W157,013,B,Letter Grade,B-,Experiential Learn
7,1,,,10102,Leigh Raiford; Selina Makana; Selina Makana,,African American Studies,R1B,001,C,Letter Grade,C+,Freshmn Compositi
7,1,,,10106,Aparajita Nanda,,African American Studies,R1B,002,C,Letter Grade,C+,Freshmn Compositi
7,1,,,10116,Cara Stanley; Cara Stanley; Leigh Raiford,,African American Studies,39D,002,C,Letter Grade,C+,Fresh/Soph Semina
7,1,,,10118,Leigh Raiford; Patrick Johnson; Patrick Johnson,,African American Studies,39E,001,C,Letter Grade,C+,Fresh/Soph Semina
7,5,,,10122,Stephen Small; Stephen Small,,African American Studies,W111,001,C,Letter Grade,C+,"Race, Class & Gen"
7,4,,,11006,Michael Cohen,,American Studies,5,001,C,Letter Grade,C+,Keywords Amer Std
7,2,,,11022,Kathleen Moran,,American Studies,5,002,C,Letter Grade,C+,Keywords Amer Std
7,1,,,11402,Ashley Lipps; Ashley Lipps,,Anthropology,1,001,C,Letter Grade,C+,Intro To Bio Anthro
7,1,,,11412,Kimberly Christensen; Kimberly Christensen,,Anthropology,2AC,001,C,Letter Grade,C+,Intro Archaeology
7,1,,,11432,Laurie Wilkie; Milad Odabaei; Milad Odabaei,,Anthropology,R5B,002,C,Letter Grade,C+,Reading & Comp
7,2,,,11442,Stephanie Etting,,Anthropology,105,001,C,Letter Grade,C+,Primate Evolution
7,1,,,12001,Darell Fields,,Architecture,11A,001,C,Letter Grade,C+,Intro Vis Rep Draw
7,1,,,12606,Elaine Yau; Elaine Yau; Gregory Levine,,History of Art,108,001,C,Letter Grade,C+,Cities And The Ar
7,4,,,13302,Bryan Mendez; Bryan Mendez; Steven Beckwith,,Astronomy,9,001,C,Letter Grade,C+,Select Topics Astro
7,1,,,13304,Gaspard Duchene,,Astronomy,10,001,C,Letter Grade,C+,General Astronomy
7,4,,,13310,Chalence Safranek-Shrader,,Astronomy,10,002,C,Letter Grade,C+,General Astronomy
7,1,,,13322,Burkhard Militzer,,Astronomy,W12,001,C,Letter Grade,C+,The Planets
7,15,,,13902,James Baxter; James Baxter; Mark Barnby; Mark Barnby; Michael Meighan; Michael Meighan,,Biology,1A,001,C,Letter Grade,C+,General Biology L
7,11,,,13910,James Baxter; James Baxter; Mark Barnby; Mark Barnby; Michael Meighan; Michael Meighan,,Biology,1AL,001,C,Letter Grade,C+,General Biology L
7,8,,,13924,Alan Shabel; Alan Shabel; Joshua Povich; Joshua Povich,,Biology,1B,001,C,Letter Grade,C+,General Biology
7,2,,,14802,Thomas Mccullough,,Business Admin-Undergrad,101A,001,C,Letter Grade,C+,Microeconomic Analy
7,1,,,14806,John Gonzales,,Business Admin-Undergrad,101B,001,C,Letter Grade,C+,Macroeconomics
7,12,,,14810,Steven Wood,,Business Admin-Undergrad,101B,002,C,Letter Grade,C+,Macroeconomics
7,2,,,14820,Rada Brooks,,Business Admin-Undergrad,102A,002,C,Letter Grade,C+,Intro Fin Account
7,3,,,14832,John Briginshaw; John Briginshaw,,Business Admin-Undergrad,102A,005,C,Letter Grade,C+,Intro Fin Account
7,3,,,14840,Jose Plehn-Dujowich,,Business Admin-Undergrad,102B,002,C,Letter Grade,C+,Intro Manager Acct
7,1,,,14844,Donatella Taurasi,,Business Admin-Undergrad,103,001,C,Letter Grade,C+,Intro To Finance
7,3,,,14848,Avinash Verma; Avinash Verma,,Business Admin-Undergrad,103,002,C,Letter Grade,C+,Intro To Finance
7,2,,,14852,John Gonzales,,Business Admin-Undergrad,103,003,C,Letter Grade,C+,Intro To Finance
7,3,,,14858,Janet Brady,,Business Admin-Undergrad,105,001,C,Letter Grade,C+,Leading People
7,1,,,14860,Holly Schroth,,Business Admin-Undergrad,105,002,C,Letter Grade,C+,Leading People
7,3,,,14861,Jo-Ellen Pozner Zeitlin,,Business Admin-Undergrad,105,003,C,Letter Grade,C+,Leading People
7,2,,,14862,Meir Karlinsky,,Business Admin-Undergrad,106,001,C,Letter Grade,C+,Marketing
7,1,,,14866,David Robinson,,Business Admin-Undergrad,106,003,C,Letter Grade,C+,Marketing
7,4,,,14868,David Robinson,,Business Admin-Undergrad,106,004,C,Letter Grade,C+,Marketing
7,1,,,14870,Wasim Azhar,,Business Admin-Undergrad,106,005,C,Letter Grade,C+,Marketing
7,10,,,14874,Steven Wood,,Business Admin-Undergrad,118,001,C,Letter Grade,C+,International Trade
7,1,,,14902,Satyaraj Berde,,Business Admin-Undergrad,127,002,C,Letter Grade,C+,Spec Topics In Acct
7,2,,,14908,Samuel Olesky,,Business Admin-Undergrad,132,001,C,Letter Grade,C+,Fin Instit & Mrkts
7,2,,,14912,Samuel Olesky,,Business Admin-Undergrad,133,001,C,Letter Grade,C+,Investments
7,3,,,14924,Brenda Fellows,,Business Admin-Undergrad,151,001,C,Letter Grade,C+,Mgmt Human Resourcs
7,4,,,14930,William Fanning,,Business Admin-Undergrad,160,001,C,Letter Grade,C+,Consumer Behavior
7,5,,,14934,William Fanning,,Business Admin-Undergrad,165,001,C,Letter Grade,C+,Advertise Strategy
7,5,,,14936,Alan Ross,,Business Admin-Undergrad,175,001,C,Letter Grade,C+,Legal Aspects
7,1,,,14940,Daniel Himelstein,,Business Admin-Undergrad,178,002,C,Letter Grade,C+,Intro Internatl Bus
7,1,,,14953,David Rochlin; David Rochlin,,Business Admin-Undergrad,193I,001,C,Letter Grade,C+,Business Abroad
7,9,,,16702,Debjani Roy,,Chemistry,1A,001,C,Letter Grade,C+,General Chemistry
7,36,,,16738,Steven Pedersen,,Chemistry,3A,001,C,Letter Grade,C+,Chem Struct React
7,3,,,16740,Steven Pedersen,,Chemistry,N3AL,001,C,Letter Grade,C+,Organic Chem Lab
7,16,,,16770,Peter Marsden; Peter Marsden,,Chemistry,3B,001,C,Letter Grade,C+,Chem Struct React
7,3,,,16772,Peter Marsden; Peter Marsden,,Chemistry,3BL,001,C,Letter Grade,C+,Organic Chem Lab
7,3,,,17801,Robert Eldridge,,Chemical Engineering,150B,001,C,Letter Grade,C+,Trans & Separa
7,1,,,18150,Maria Echaveste,,Chicano Studies,174,001,C,Letter Grade,C+,"Chic, Law, Crim J"
7,3,,,18506,Andrea Broaddus; Andrea Broaddus,,City & Regional Planning,114,001,C,Letter Grade,C+,Intro Urb Reg Tra
7,2,,,18701,Michael Taptich; Michael Taptich,,Civil & Environmental Eng,11,001,C,Letter Grade,C+,Eng Sys & Susta
7,1,,,18702,Sanjay Govindjee,,Civil & Environmental Eng,W30,001,C,Letter Grade,C+,Intro Solid Mechn
7,1,,,19002,Ian Anderson; Ian Anderson,,Classics,10A,001,C,Letter Grade,C+,Intro Greek Civ
7,6,,,19202,Paul Li; Paul Li,,Cognitive Science,N1,001,C,Letter Grade,C+,Intro To Cog Sci
7,6,,,19208,Terrance Regier; Terrance Regier,,Cognitive Science,N1,004,C,Letter Grade,C+,Intro To Cog Sci
7,3,,,19212,Andrew Garrett; Oana David; Oana David,,Cognitive Science,C101,001,C,Letter Grade,C+,Mind And Language
7,1,,,19215,Alexandra Carstensen; Alexandra Carstensen; Terrance Regier; Terrance Regier,,Cognitive Science,C142,001,C,Letter Grade,C+,Language & Thou
7,1,,,19430,Margi Wald; Rachel Kotok,,College Writing Programs,5C,001,C,Letter Grade,C+,Engl Thru Film
7,3,,,19450,Carolyn Carr; Margi Wald,,College Writing Programs,5H,001,C,Letter Grade,C+,Engl Sustainabili
7,1,,,19498,Amanda Fox; Margi Wald,,College Writing Programs,6J,001,C,Letter Grade,C+,Esl Test Prep
7,1,,,19554,Jennifer Johnson; Jennifer Johnson; Margi Wald,,College Writing Programs,8,005,C,Letter Grade,C+,Engl As Second La
7,1,,,19582,Joyce Podevyn; Margi Wald,,College Writing Programs,9C,002,C,Letter Grade,C+,Acad Writ-Multili
7,1,,,19612,Margi Wald; Melody Noll,,College Writing Programs,9I,001,C,Letter Grade,C+,Esp Conflict Res
7,1,,,19660,Joyce Podevyn; Margi Wald,,College Writing Programs,9Y,001,C,Letter Grade,C+,Esp Creative Wrti
7,1,,,19672,Kathleen Mccarney; Margi Wald,,College Writing Programs,5K,002,C,Letter Grade,C+,Culture And Media
7,1,,,20106,Jordan Greenwald; Jordan Greenwald; Miryam Sas,,Comparative Literature,N60AC,001,C,Letter Grade,C+,Lit Amer Cultures
7,2,,,20110,Keith Budner; Keith Budner; Miryam Sas,,Comparative Literature,N60AC,003,C,Letter Grade,C+,Lit Amer Cultures
7,1,,,21512,Sean Ford; Sean Ford,,Earth & Planetary Science,20,002,C,Letter Grade,C+,Earthquakes
7,5,,,21518,Douglas Long; Douglas Long,,Earth & Planetary Science,N82,001,C,Letter Grade,C+,Intro To Oceans
7,8,,,21902,Monica Deza; Monica Deza,,Economics,1,001,C,Letter Grade,C+,Intro To Economics
7,4,,,21920,Claire Duquennois; Claire Duquennois,,Economics,C3,001,C,Letter Grade,C+,Intro To Env Econ
7,4,,,21930,Scott Carson,,Economics,100A,001,C,Letter Grade,C+,Micro Analysis
7,5,,,21958,Sandhyarani Patlolla,,Economics,N110,001,C,Letter Grade,C+,Game Theory Soc Sci
7,2,,,21962,Liang Lu; Liang Lu,,Economics,C125,001,C,Letter Grade,C+,Environmental Econ
7,1,,,21973,Calanit Kamala; Calanit Kamala,,Economics,133,001,C,Letter Grade,C+,Glob Ineq And Growt
7,2,,,21976,Scott Carson,,Economics,140,001,C,Letter Grade,C+,Econometrics
7,2,,,22000,Calanit Kamala; Calanit Kamala,,Economics,N181,001,C,Letter Grade,C+,Internat'L Trade
7,2,,,22001,Michael Jansson,,Economics,182,001,C,Letter Grade,C+,Intl Monet Econ
7,4,,,22412,Liang Lu; Liang Lu,,Environ Econ & Policy,C101,001,C,Letter Grade,C+,Environmental Eco
7,1,,,22534,Glynda Hull,,Education,N190,002,C,Letter Grade,C+,Critical Studies
7,1,,,22536,Glynda Hull,,Education,N190,003,C,Letter Grade,C+,Critical Studies
7,3,,,24002,Alexander Mckinney; Alexander Mckinney; Ian Birnam; Ian Birnam,,Computer Science,10,001,C,Letter Grade,C+,Beauty Joy Comput
7,11,,,24012,Brian Hou; Brian Hou; Marvin Zhang; Marvin Zhang,,Computer Science,61A,001,C,Letter Grade,C+,Str Interp Cmp Pr
7,23,,,24054,Alan Yao; Alan Yao; Sarah Kim; Sarah Kim,,Computer Science,61BL,001,C,Letter Grade,C+,Data Strs Prog Me
7,8,,,24072,Justin Hsia; Justin Hsia; Shreyas Chand; Shreyas Chand,,Computer Science,61C,001,C,Letter Grade,C+,Machine Structure
7,18,,,24094,Christos Alexandros Psomas; Christos-Alexandros Psomas; David Dinh; David Dinh; Fan Ye; Fan Ye,,Computer Science,70,001,C,Letter Grade,C+,Discrete Math&P
7,7,,,24138,Daniel Garcia; Daniel Garcia; Davis Foote; Davis Foote; Jacob Andreas; Jacob Andreas,,Computer Science,188,001,C,Letter Grade,C+,Artif Intelligenc
7,2,,,24802,Jeffery Greenblatt,,Energy and Resources,C100,001,C,Letter Grade,C+,"Energy, Society"
7,3,,,25207,Andrew Packard; Andrew Packard; Panayiotis Papadopoulos; Panayiotis Papadopoulos,,Engineering,W7,001,C,Letter Grade,C+,Intr Computer Prog
7,2,,,25704,Elizabeth Keithley; Elizabeth Keithley,,English,R1AN,001,C,Letter Grade,C+,1st-Yr Read & Com
7,1,,,25706,Luisa Giulianetti,,English,R1AN,002,C,Letter Grade,C+,1st-Yr Read & Com
7,1,,,25710,Mitchell Breitwieser; Rosalind Diaz; Rosalind Diaz,,English,N1B,001,C,Letter Grade,C+,1st-Yr Read & Com
7,4,,,25724,Donna Jones; Donna Jones,,English,N125D,001,C,Letter Grade,C+,20th Century Nove
7,1,,,25726,Kirsten Tranter,,English,N141,001,C,Letter Grade,C+,Modes Of Writing
7,1,,,25730,Jasper Bernes; Jasper Bernes,,English,N166,002,C,Letter Grade,C+,Special Topics
7,1,,,25732,Mitchell Breitwieser,,English,N173,001,C,Letter Grade,C+,Lang & Lit Films
7,1,,,25734,Donna Jones; Donna Jones,,English,N180Z,001,C,Letter Grade,C+,Science Fiction
7,1,,,26302,Kate Hawkinson,,Visual Studies,185X,001,C,Letter Grade,C+,Word And Image
7,1,,,26601,Timothy Markowitz,,"Env Sci, Policy, & Mgmt",15,001,C,Letter Grade,C+,Intro Environ Sci
7,1,,,26612,Kenneth Worthy; Kenneth Worthy,,"Env Sci, Policy, & Mgmt",50AC,002,C,Letter Grade,C+,Intro Cult/Res Mgt
7,1,,,26639,Timothy Markowitz,,"Env Sci, Policy, & Mgmt",C103,001,C,Letter Grade,C+,Prin Conserv Biol
7,3,,,26642,Kevin O'Hara,,"Env Sci, Policy, & Mgmt",105B,001,C,Letter Grade,C+,For Measurements
7,1,,,27518,Michael Schulze-Oechtering; Michael Schulze-Oechtering,,Ethnic Studies,21AC,001,C,Letter Grade,C+,Comp Surv Ethnic
7,1,,,27540,Edgar Mojica; Edgar Mojica; Raymond Telles,,Ethnic Studies,122AC,002,C,Letter Grade,C+,Eth/Race In Am Fi
7,1,,,28210,Emily Carpenter; Emily Carpenter,,Film,50,001,C,Letter Grade,C+,Film Intr:Nonmajors
7,2,,,28212,Jeffrey Skoller; Jeffrey Skoller; Justin Vaccaro; Justin Vaccaro,,Film,108,001,C,Letter Grade,C+,Film Genre
7,1,,,28220,Eileen Jones; Eileen Jones,,Film,129,001,C,Letter Grade,C+,Avant-Garde Film
7,1,,,28702,Marion Phillips; Marion Phillips; Seda Chavdarian,,French,1,001,C,Letter Grade,C+,Elementary French
7,1,,,28704,Seda Chavdarian; Trevor Sanders; Trevor Sanders,,French,1,002,C,Letter Grade,C+,Elementary French
7,1,,,28726,Debarati Sanyal; Vanessa Brutsche; Vanessa Brutsche,,French,121A,001,C,Letter Grade,C+,"Theme, Genre, Struc"
