13,1,,,39908,Brandon Williams; Brandon Williams; Lawrence Evans,,Mathematics,110,002,F,Letter Grade,F,Linear Algebra
13,2,,,39912,James Mcivor; James Mcivor; Lawrence Evans,,Mathematics,113,001,F,Letter Grade,F,Abstract Algebra
13,6,,,39916,Jesse Elliott; Jesse Elliott,,Mathematics,113,002,F,Letter Grade,F,Abstract Algebra
13,1,,,39920,Lawrence Evans; Shiyu Li; Shiyu Li,,Mathematics,115,001,F,Letter Grade,F,Intro Number Theory
13,1,,,39924,Kevin O'Neill; Kevin Oneill; Lawrence Evans,,Mathematics,126,001,F,Letter Grade,F,Intro Part Dif Equa
13,2,,,39926,John Strain; John Strain,,Mathematics,128A,001,F,Letter Grade,F,Numerical Analysis
13,2,,,39938,Albert Ai; Albert Ai; Lawrence Evans,,Mathematics,185,002,F,Letter Grade,F,Complex Analysis
13,1,,,40136,James Robertson; James Robertson; Lawrence Evans,,Mathematics,10A,001,F,Letter Grade,F,Methods Of Math
13,1,,,40502,Christopher Dames; Christopher Dames; Miguel Sierra Aznar; Miguel Sierra Aznar,,Mechanical Engineering,40,001,F,Letter Grade,F,Thermodynamics
13,4,,,40506,Sanjay Govindjee,,Mechanical Engineering,W85,001,F,Letter Grade,F,Intro Solid Mechn
13,1,,,40520,Oliver O'Reilly,,Mechanical Engineering,104,001,F,Letter Grade,F,Engr Mechanics Ii
13,1,,,40524,Jocelyn Bale-Glickman; Jocelyn Bale-Glickman,,Mechanical Engineering,106,001,F,Letter Grade,F,Fluid Mechanics
13,1,,,40534,David Rich; David Rich,,Mechanical Engineering,109,001,F,Letter Grade,F,Heat Transfer
13,6,,,41402,Josh Jackson,,Media Studies,N10,001,F,Letter Grade,F,Intro To Mediast
13,3,,,42702,Robin Ball; Robin Ball,,Molecular & Cell Biology,32,001,F,Letter Grade,F,Intro Human Physi
13,2,,,42708,Robin Ball; Robin Ball,,Molecular & Cell Biology,32L,001,F,Letter Grade,F,Int Human Phys La
13,5,,,42714,David Presti,,Molecular & Cell Biology,W61,001,F,Letter Grade,F,Brain Mind Behavi
13,2,,,42716,David Larue,,Molecular & Cell Biology,63,001,F,Letter Grade,F,Intro Funct Neuro
13,2,,,42718,Natalia Caporale; Natalia Caporale,,Molecular & Cell Biology,C64,001,F,Letter Grade,F,Exploring The Bra
13,12,,,42762,Natalia Caporale; Natalia Caporale,,Molecular & Cell Biology,102,001,F,Letter Grade,F,Surv Biochem &
13,1,,,42786,Kathleen Ryan,,Molecular & Cell Biology,C112,001,F,Letter Grade,F,Gen Microbiology
13,1,,,43406,Robert Yamasato; Robert Yamasato,,Music,20A,003,F,Letter Grade,F,Basic Musicianship
13,1,,,43408,Merav Singer; Merav Singer,,Music,20A,004,F,Letter Grade,F,Basic Musicianship
13,1,,,43416,Cindy Cox; Elizabeth De Martelly; Elizabeth De Martelly,,Music,N26AC,002,F,Letter Grade,F,Music In Amer Cul
13,1,,,43424,Candace Johnson,,Music,44,002,F,Letter Grade,F,Voice Class
13,1,,,43426,Jacqueline Chew,,Music,45,001,F,Letter Grade,F,Beginning Piano 1
13,1,,,43430,Jacqueline Chew,,Music,45,003,F,Letter Grade,F,Beginning Piano 1
13,1,,,44102,Beth Piatote; Sonia Hart; Sonia Suarez,,Native American Studies,R1A,001,F,Letter Grade,F,"Reading,Compositi"
13,2,,,45802,Greg Niemeyer; Nicholaus Gutierrez; Nicholaus Gutierrez,,New Media,R1B,001,F,Letter Grade,F,New Media R&C
13,1,,,46306,Nastaran Faghihnia; Nastaran Faghihnia,,Nutritional Science & Tox,10,002,F,Letter Grade,F,Intro Human Nutr
13,2,,,47104,Tetsushi Ogata,,Peace & Conflict Studies,127,001,F,Letter Grade,F,Hr And Global Poli
13,1,,,47108,Beth Roy; Beth Roy,,Peace & Conflict Studies,159,001,F,Letter Grade,F,Con Res Intes Train
13,1,,,47306,Daniel Khokhar; Daniel Khokhar; Hannah Ginsborg,,Philosophy,2,002,F,Letter Grade,F,Ind Moral/Soc Just
13,1,,,47322,Hannah Ginsborg; Russell Buehler; Russell Buehler,,Philosophy,12A,001,F,Letter Grade,F,Intro To Logic
13,1,,,47326,Ethan Jerzak; Ethan Jerzak; Hannah Ginsborg,,Philosophy,12A,002,F,Letter Grade,F,Intro To Logic
13,3,,,47334,Hannah Ginsborg; Quinn Gibson; Quinn Gibson,,Philosophy,25A,002,F,Letter Grade,F,Ancient Philosophy
13,1,,,47342,Timothy Crockett; Timothy Crockett,,Philosophy,25B,002,F,Letter Grade,F,Modern Philosophy
13,2,,,47702,Toni Mar,,Physical Education,1,201,F,Letter Grade,F,Pe Activities
13,1,,,47704,Toni Mar,,Physical Education,1,202,F,Letter Grade,F,Pe Activities
13,1,,,48002,Matthias Reinsch; Matthias Reinsch,,Physics,7A,001,F,Letter Grade,F,Scient Engin Phys
13,2,,,48020,Michael Bloxham,,Physics,7B,001,F,Letter Grade,F,Scient Engin Phys
13,4,,,48052,William Golightly; William Golightly,,Physics,8A,001,F,Letter Grade,F,Intro Physics
13,1,,,48090,Terrence Buehler; Terrence Buehler,,Physics,8B,001,F,Letter Grade,F,Intro Physics
13,5,,,48152,Charles Wohl,,Physics,137A,001,F,Letter Grade,F,Quantum Mechanics
13,1,,,48710,Kathleen Ryan,,Plant & Microbial Biology,C112,001,F,Letter Grade,F,Gen Microbiology
13,1,,,49202,Stephanie Ballenger; Stephanie Ballenger,,Political Economy,100,001,F,Letter Grade,F,Theory Of Pol Eco
13,1,,,49204,Fatmir Haskaj,,Political Economy,101,001,F,Letter Grade,F,Contemp Theo Pol
13,6,,,49602,Eric Schickler; Jacob Grumbach; Jacob Grumbach,,Political Science,N1AC,001,F,Letter Grade,F,Intro Amer Pol
13,1,,,49612,Eric Schickler; Tara Buss; Tara Buss,,Political Science,2,001,F,Letter Grade,F,Intro Comparat Po
13,5,,,49642,Eric Schickler; Geoffrey Upton; Geoffrey Upton,,Political Science,116U,001,F,Letter Grade,F,Topics Pol Theory
13,9,,,49672,Sean Gailmard,,Political Science,W135,001,F,Letter Grade,F,Game Theory
13,1,,,49692,Mahmood Monshipouri,,Political Science,142A,001,F,Letter Grade,F,Middle East Pol
13,2,,,49702,Pradeep Chhibber,,Political Science,W145A,001,F,Letter Grade,F,Poli Dev India
13,12,,,50202,Davina Chan; Davina Chan,,Psychology,N1,001,F,Letter Grade,F,General Psychology
13,6,,,50206,Robin Ball; Robin Ball,,Psychology,3,001,F,Letter Grade,F,How The Brain Works
13,6,,,50208,Christopher Gade; Christopher Gade,,Psychology,6,001,F,Letter Grade,F,Stress And Coping
13,2,,,50210,Arman Catterson; Arman Catterson,,Psychology,7,001,F,Letter Grade,F,Person In Big Data
13,1,,,50212,Arman Catterson; Arman Catterson,,Psychology,10,001,F,Letter Grade,F,Res & Data Anal
13,7,,,50258,Natalia Caporale; Natalia Caporale,,Psychology,C64,001,F,Letter Grade,F,Exploring The Brain
13,3,,,50282,Arman Catterson; Arman Catterson,,Psychology,101,001,F,Letter Grade,F,Res & Data Anal
13,1,,,50296,James Mc Hale; James Mchale,,Psychology,N130,001,F,Letter Grade,F,Clinical Psychology
13,1,,,50300,Ephrem Fernandez,,Psychology,N135,001,F,Letter Grade,F,Treating Mental Ill
13,2,,,50302,James Mc Hale; James Mchale,,Psychology,136,001,F,Letter Grade,F,Human Sexuality
13,2,,,50304,Ephrem Fernandez,,Psychology,139,001,F,Letter Grade,F,Clinical Case Study
13,3,,,50308,Amy Cook; Amy Cook,,Psychology,N140,002,F,Letter Grade,F,Development Psych
13,2,,,50310,Oliver John,,Psychology,N150,001,F,Letter Grade,F,Personality Psych
13,7,,,50312,Christopher Gade; Christopher Gade,,Psychology,N160,001,F,Letter Grade,F,Social Psychology
13,5,,,50718,Peter Dailey; Peter Dailey,,Public Health,162A,001,F,Letter Grade,F,Pub Hlth Microbio
13,1,,,53602,Lyubov Golburt; Lyubov Golburt; Thomas Dyne; Thomas Dyne,,Slavic Languages & Lit,R5B,001,F,Letter Grade,F,Reading And Comp
13,1,,,54938,Kimberly Klein,,Social Welfare,155,001,F,Letter Grade,F,Hum Svcs Fndraisi
13,2,,,55502,Kristen Nelson; Kristen Nelson; Michael Burawoy,,Sociology,3AC,001,F,Letter Grade,F,Prin Soc: Am Cultur
13,2,,,55504,James Lamb; James Lamb; Michael Burawoy,,Sociology,5,001,F,Letter Grade,F,Eval Of Evidence
13,3,,,55510,Linus Huang; Linus Huang,,Sociology,110,001,F,Letter Grade,F,Org & Soc Insti
13,1,,,55512,Mario Castillo; Mario Castillo; Michael Burawoy,,Sociology,111AC,001,F,Letter Grade,F,Socio Of The Family
13,1,,,55516,Fithawee Tzeggai; Fithawee Tzeggai; Michael Burawoy,,Sociology,113AC,001,F,Letter Grade,F,Education
13,2,,,55522,Laleh Behbehanian; Laleh Behbehanian,,Sociology,140,001,F,Letter Grade,F,Polit & Soc Cha
13,1,,,55528,Edwin Lin; Edwin Lin,,Sociology,167,001,F,Letter Grade,F,Virtual Communities
13,1,,,58218,Camilo Jaramillo; Camilo Jaramillo Castrillon; Estelle Tarica,,Spanish,102A,001,F,Letter Grade,F,Adv Gram And Comp
13,1,,,58226,Elizabeth Spragins,,Spanish,135,001,F,Letter Grade,F,Hispanic Literatu
13,1,,,58228,Flor Lopez; Flor Lopez Malagamba; Natalia Brizuela,,Spanish,135,002,F,Letter Grade,F,Hispanic Literatu
13,2,,,58712,Seema Singh Saharan,,Statistics,2,001,F,Letter Grade,F,Intro To Stat
13,4,,,58720,Fletcher Ibser; Fletcher Ibser,,Statistics,20,001,F,Letter Grade,F,Intro Prob Stat Cal
13,14,,,58726,Fletcher Ibser; Fletcher Ibser,,Statistics,W21,001,F,Letter Grade,F,Intro Prob Stat Bus
13,1,,,58738,Michael Jordan; Thanh-Nhan Do; Thanh-Nhan Do,,Statistics,133,001,F,Letter Grade,F,Computing Data
13,3,,,58742,Michael Jordan; Wenpin Tang; Wenpin Tang,,Statistics,134,001,F,Letter Grade,F,Concepts Of Prob
13,2,,,58750,Seema Singh Saharan,,Statistics,135,001,F,Letter Grade,F,Concepts Of Stat
13,1,,,59512,Maureen Tang; Maureen Tang,,Theater Dance & Perf Stds,10,003,F,Letter Grade,F,Fund. Of Acting I
13,6,,,59530,Abigail De Kosnik; Christian Nagler; Christian Nagler; Takeo Rivera; Takeo Rivera,,Theater Dance & Perf Stds,118AC,001,F,Letter Grade,F,"Perf, Tv, Soc Med"
13,1,,,59826,Jeroen Dewulf,,UGIS-UG Interdisc Studies,W158,010,F,Letter Grade,F,Global Citizenship
13,1,,,59842,Joel Clark,,UGIS-UG Interdisc Studies,W157,007,F,Letter Grade,F,Experiential Learn
22,7,,,10116,Cara Stanley; Cara Stanley; Leigh Raiford,,African American Studies,39D,002,Credit,Non-Letter Grade,Pass,Fresh/Soph Semina
22,4,,,10118,Leigh Raiford; Patrick Johnson; Patrick Johnson,,African American Studies,39E,001,Credit,Non-Letter Grade,Pass,Fresh/Soph Semina
22,38,,,10122,Stephen Small; Stephen Small,,African American Studies,W111,001,Credit,Non-Letter Grade,Pass,"Race, Class & Gen"
22,3,,,10130,Frederick Vincent; Frederick Vincent,,African American Studies,159,001,Credit,Non-Letter Grade,Pass,Spec Top Afam Lit
22,3,,,10134,Ameer Loggins; Ameer Loggins; Leigh Raiford,,African American Studies,159,003,Credit,Non-Letter Grade,Pass,Spec Top Afam Lit
22,5,,,11006,Michael Cohen,,American Studies,5,001,Credit,Non-Letter Grade,Pass,Keywords Amer Std
22,6,,,11022,Kathleen Moran,,American Studies,5,002,Credit,Non-Letter Grade,Pass,Keywords Amer Std
22,3,,,11024,Michael Cohen,,American Studies,5,003,Credit,Non-Letter Grade,Pass,Keywords Amer Std
22,1,,,11026,Christine Palmer; Christine Palmer,,American Studies,199,003,Credit,Non-Letter Grade,Pass,Superv Indep Stud
22,1,,,11402,Ashley Lipps; Ashley Lipps,,Anthropology,1,001,Credit,Non-Letter Grade,Pass,Intro To Bio Anthro
22,1,,,11412,Kimberly Christensen; Kimberly Christensen,,Anthropology,2AC,001,Credit,Non-Letter Grade,Pass,Intro Archaeology
22,6,,,11420,M. George; Mary Mather George,,Anthropology,3AC,001,Credit,Non-Letter Grade,Pass,Intro Soc/Cult Ac
22,1,,,11454,Jillian Swift; Jillian Swift,,Anthropology,128M,001,Credit,Non-Letter Grade,Pass,Topics:Arch/Method
22,2,,,11458,M. George; Mary Mather George,,Anthropology,169B,001,Credit,Non-Letter Grade,Pass,Res Theo/Meth Soc
22,1,,,11462,Kimberly Christensen; Kimberly Christensen,,Anthropology,174AC,001,Credit,Non-Letter Grade,Pass,Ca Historical Anth
22,1,,,12002,Mark Schatz,,Architecture,108,001,Credit,Non-Letter Grade,Pass,Arch Internship
22,7,,,12006,Joris Komen; Joris Komen,,Architecture,124A,001,Credit,Non-Letter Grade,Pass,3-D Computer Tech
22,4,,,12008,Joris Komen; Joris Komen,,Architecture,124A,002,Credit,Non-Letter Grade,Pass,3-D Computer Tech
22,2,,,12014,Brendon Levitt; Brendon Levitt,,Architecture,149,001,Credit,Non-Letter Grade,Pass,Spec Top Erg Envir
22,8,,,12018,Mark Schatz,,Architecture,198,002,Credit,Non-Letter Grade,Pass,Directed Group Stdy
22,1,,,12306,Isaac Vazquez Avila; Isaac Vazquez Avila,,Art Practice,8,003,Credit,Non-Letter Grade,Pass,Intro Vis Thinking
22,1,,,12308,Michael Berens; Michael Berens,,Art Practice,8,004,Credit,Non-Letter Grade,Pass,Intro Vis Thinking
22,2,,,12312,Aida Gamez; Aida Gamez,,Art Practice,12,002,Credit,Non-Letter Grade,Pass,Lang Of Draw
22,3,,,12314,Azin Seraj; Azin Seraj,,Art Practice,21,001,Credit,Non-Letter Grade,Pass,Digital Photography
22,1,,,12324,Jenifer Wofford; Jenifer Wofford,,Art Practice,119,001,Credit,Non-Letter Grade,Pass,Gpca
22,1,,,12328,Michelle Ott; Michelle Ott,,Art Practice,180,002,Credit,Non-Letter Grade,Pass,Advanced Digital Ph
22,1,,,12604,Gregory Levine; Matthew Culler; Matthew Culler,,History of Art,R1B,002,Credit,Non-Letter Grade,Pass,Visual Experience
22,1,,,12606,Elaine Yau; Elaine Yau; Gregory Levine,,History of Art,108,001,Credit,Non-Letter Grade,Pass,Cities And The Ar
22,1,,,12608,Gregory Levine; Sarah Cowan; Sarah Cowan,,History of Art,N182,001,Credit,Non-Letter Grade,Pass,Hist Of Photograp
22,1,,,12610,Emma Silverman; Emma Silverman; Gregory Levine,,History of Art,187AC,001,Credit,Non-Letter Grade,Pass,American Art/Ac
22,1,,,12916,Hannah Michell,,Asian American Studies,138,001,Credit,Non-Letter Grade,Pass,Topics Asn Pop Cult
22,2,,,12918,Thomas Fleming,,Asian American Studies,141,001,Credit,Non-Letter Grade,Pass,Law In Asam Commun
22,1,,,12922,Joanne Rondilla; Joanne Rondilla,,Asian American Studies,171,001,Credit,Non-Letter Grade,Pass,"Asam In Film, Video"
22,2,,,12932,Carolyn Chen; Carolyn Chen,,Asian American Studies,197,003,Credit,Non-Letter Grade,Pass,Field Study
22,1,,,12936,Lisa Hirai; Lisa Hirai Tsuchitani,,Asian American Studies,199,002,Credit,Non-Letter Grade,Pass,Superv Indep Study
22,4,,,13302,Bryan Mendez; Bryan Mendez; Steven Beckwith,,Astronomy,9,001,Credit,Non-Letter Grade,Pass,Select Topics Astro
22,2,,,13304,Gaspard Duchene,,Astronomy,10,001,Credit,Non-Letter Grade,Pass,General Astronomy
22,7,,,13310,Chalence Safranek-Shrader,,Astronomy,10,002,Credit,Non-Letter Grade,Pass,General Astronomy
22,29,,,13322,Burkhard Militzer,,Astronomy,W12,001,Credit,Non-Letter Grade,Pass,The Planets
22,1,,,13692,Jay Keasling,,Bioengineering,199,011,Credit,Non-Letter Grade,Pass,Superv Indep Stud
22,2,,,13902,James Baxter; James Baxter; Mark Barnby; Mark Barnby; Michael Meighan; Michael Meighan,,Biology,1A,001,Credit,Non-Letter Grade,Pass,General Biology L
22,2,,,13910,James Baxter; James Baxter; Mark Barnby; Mark Barnby; Michael Meighan; Michael Meighan,,Biology,1AL,001,Credit,Non-Letter Grade,Pass,General Biology L
22,2,,,13924,Alan Shabel; Alan Shabel; Joshua Povich; Joshua Povich,,Biology,1B,001,Credit,Non-Letter Grade,Pass,General Biology
22,4,,,14506,Alexander Von Rospatt; Kristina Anderson; Kristina Anderson,,Buddhist Studies,114,001,Credit,Non-Letter Grade,Pass,Tibetan Buddhism
22,5,,,14802,Thomas Mccullough,,Business Admin-Undergrad,101A,001,Credit,Non-Letter Grade,Pass,Microeconomic Analy
22,5,,,14810,Steven Wood,,Business Admin-Undergrad,101B,002,Credit,Non-Letter Grade,Pass,Macroeconomics
22,1,,,14820,Rada Brooks,,Business Admin-Undergrad,102A,002,Credit,Non-Letter Grade,Pass,Intro Fin Account
22,1,,,14824,James Webb,,Business Admin-Undergrad,102A,003,Credit,Non-Letter Grade,Pass,Intro Fin Account
22,4,,,14840,Jose Plehn-Dujowich,,Business Admin-Undergrad,102B,002,Credit,Non-Letter Grade,Pass,Intro Manager Acct
22,6,,,14844,Donatella Taurasi,,Business Admin-Undergrad,103,001,Credit,Non-Letter Grade,Pass,Intro To Finance
22,2,,,14848,Avinash Verma; Avinash Verma,,Business Admin-Undergrad,103,002,Credit,Non-Letter Grade,Pass,Intro To Finance
22,5,,,14852,John Gonzales,,Business Admin-Undergrad,103,003,Credit,Non-Letter Grade,Pass,Intro To Finance
22,2,,,14858,Janet Brady,,Business Admin-Undergrad,105,001,Credit,Non-Letter Grade,Pass,Leading People
22,2,,,14861,Jo-Ellen Pozner Zeitlin,,Business Admin-Undergrad,105,003,Credit,Non-Letter Grade,Pass,Leading People
22,8,,,14862,Meir Karlinsky,,Business Admin-Undergrad,106,001,Credit,Non-Letter Grade,Pass,Marketing
22,3,,,14864,Meir Karlinsky,,Business Admin-Undergrad,106,002,Credit,Non-Letter Grade,Pass,Marketing
22,8,,,14866,David Robinson,,Business Admin-Undergrad,106,003,Credit,Non-Letter Grade,Pass,Marketing
22,6,,,14868,David Robinson,,Business Admin-Undergrad,106,004,Credit,Non-Letter Grade,Pass,Marketing
22,4,,,14872,Alan Ross,,Business Admin-Undergrad,107,001,Credit,Non-Letter Grade,Pass,Soc & Pol Eth Env
22,1,,,14874,Steven Wood,,Business Admin-Undergrad,118,001,Credit,Non-Letter Grade,Pass,International Trade
22,1,,,14886,Francis Stanton,,Business Admin-Undergrad,120AB,001,Credit,Non-Letter Grade,Pass,Int Fin Accnting 2
22,3,,,14902,Satyaraj Berde,,Business Admin-Undergrad,127,002,Credit,Non-Letter Grade,Pass,Spec Topics In Acct
22,6,,,14904,Avinash Verma; Avinash Verma,,Business Admin-Undergrad,131,001,Credit,Non-Letter Grade,Pass,Corp Fin Analysis
22,1,,,14912,Samuel Olesky,,Business Admin-Undergrad,133,001,Credit,Non-Letter Grade,Pass,Investments
22,4,,,14916,Arash Namvar; Arash Namvar,,Business Admin-Undergrad,133,002,Credit,Non-Letter Grade,Pass,Investments
22,1,,,14922,Konstantin Magin; Konstantin Magin,,Business Admin-Undergrad,137,001,Credit,Non-Letter Grade,Pass,Spec Topics In Fin
22,1,,,14924,Brenda Fellows,,Business Admin-Undergrad,151,001,Credit,Non-Letter Grade,Pass,Mgmt Human Resourcs
22,1,,,14928,Daniel Mulhern,,Business Admin-Undergrad,155,001,Credit,Non-Letter Grade,Pass,Leadership
22,6,,,14930,William Fanning,,Business Admin-Undergrad,160,001,Credit,Non-Letter Grade,Pass,Consumer Behavior
22,4,,,14934,William Fanning,,Business Admin-Undergrad,165,001,Credit,Non-Letter Grade,Pass,Advertise Strategy
22,8,,,14936,Alan Ross,,Business Admin-Undergrad,175,001,Credit,Non-Letter Grade,Pass,Legal Aspects
22,6,,,14938,Daniel Himelstein,,Business Admin-Undergrad,178,001,Credit,Non-Letter Grade,Pass,Intro Internatl Bus
22,3,,,14940,Daniel Himelstein,,Business Admin-Undergrad,178,002,Credit,Non-Letter Grade,Pass,Intro Internatl Bus
22,5,,,14942,Omar Romero-Hernandez,,Business Admin-Undergrad,190T,001,Credit,Non-Letter Grade,Pass,Topics Innov/Design
22,1,,,14950,Omar Romero-Hernandez,,Business Admin-Undergrad,192T,001,Credit,Non-Letter Grade,Pass,Topics In Csr
22,22,,,14952,Erika Burns; Erika Walker,,Business Admin-Undergrad,193C,001,Credit,Non-Letter Grade,Pass,Cpt Int'L Stdnts
22,1,,,14953,David Rochlin; David Rochlin,,Business Admin-Undergrad,193I,001,Credit,Non-Letter Grade,Pass,Business Abroad
22,1,,,14960,Dana Carney,,Business Admin-Undergrad,199,002,Credit,Non-Letter Grade,Pass,Superv Indep Study
22,3,,,14964,David Rochlin; David Rochlin,,Business Admin-Undergrad,193I,002,Credit,Non-Letter Grade,Pass,Business Abroad
22,6,,,16702,Debjani Roy,,Chemistry,1A,001,Credit,Non-Letter Grade,Pass,General Chemistry
22,1,,,16706,Debjani Roy,,Chemistry,1AL,001,Credit,Non-Letter Grade,Pass,General Chem Lab
22,4,,,16738,Steven Pedersen,,Chemistry,3A,001,Credit,Non-Letter Grade,Pass,Chem Struct React
22,1,,,16740,Steven Pedersen,,Chemistry,N3AL,001,Credit,Non-Letter Grade,Pass,Organic Chem Lab
22,2,,,16770,Peter Marsden; Peter Marsden,,Chemistry,3B,001,Credit,Non-Letter Grade,Pass,Chem Struct React
22,4,,,17178,Marcin Majda,,Chemistry,197,036,Credit,Non-Letter Grade,Pass,Field Study In Chem
22,4,,,17872,Marcin Majda,,Chemical Engineering,197,001,Credit,Non-Letter Grade,Pass,Field Study
22,10,,,18122,Edgar Mojica; Edgar Mojica; Keith Feldman,,Chicano Studies,50,001,Credit,Non-Letter Grade,Pass,Intro Chicano His
22,3,,,18142,Lara Medina,,Chicano Studies,110,001,Credit,Non-Letter Grade,Pass,Latina/O Phil & R
22,6,,,18144,Raymond Telles,,Chicano Studies,135C,001,Credit,Non-Letter Grade,Pass,Latino Doc Film
22,1,,,18302,Chunhong Xie; Damien Donnelly; Damien Donnelly,,Chinese,1,001,Credit,Non-Letter Grade,Pass,Elem Chinese Inte
22,4,,,18304,Paula Varsano; Yun-Ling Wang; Yun-Ling Wang,,Chinese,7A,001,Credit,Non-Letter Grade,Pass,Premod Chinese Li
22,1,,,18312,Weisi Cai; Xianghua Wu,,Chinese,10,001,Credit,Non-Letter Grade,Pass,Inter Chinese Int
22,1,,,18314,I-Hao Li,,Chinese,105,001,Credit,Non-Letter Grade,Pass,Business Chinese
22,2,,,18502,David Amos; David Amos; Robert Cervero,,City & Regional Planning,110,001,Credit,Non-Letter Grade,Pass,Intro To City Pln
22,1,,,18504,Alainna Thomas; Alainna Thomas,,City & Regional Planning,113B,001,Credit,Non-Letter Grade,Pass,Commty & Econ Dev
22,1,,,18506,Andrea Broaddus; Andrea Broaddus,,City & Regional Planning,114,001,Credit,Non-Letter Grade,Pass,Intro Urb Reg Tra
22,2,,,18508,Ricardo Huerta; Ricardo Huerta,,City & Regional Planning,118AC,001,Credit,Non-Letter Grade,Pass,The Urban Comm
22,1,,,18701,Michael Taptich; Michael Taptich,,Civil & Environmental Eng,11,001,Credit,Non-Letter Grade,Pass,Eng Sys & Susta
22,1,,,18707,Claudia Ostertag,,Civil & Environmental Eng,99,002,Credit,Non-Letter Grade,Pass,Superv Indep Stud
22,2,,,18734,Paulo Monteiro; Paulo Monteiro,,Civil & Environmental Eng,199,005,Credit,Non-Letter Grade,Pass,Superv Indep Stud
22,1,,,18736,Claudia Ostertag,,Civil & Environmental Eng,199,006,Credit,Non-Letter Grade,Pass,Superv Indep Stud
22,1,,,18739,Arpad Horvath,,Civil & Environmental Eng,199,008,Credit,Non-Letter Grade,Pass,Superv Indep Stud
22,3,,,18820,Khalid Mosalam,,Civil & Environmental Eng,199,010,Credit,Non-Letter Grade,Pass,Superv Indep Stud
22,1,,,18822,Slawomir Hermanowicz,,Civil & Environmental Eng,199,011,Credit,Non-Letter Grade,Pass,Superv Indep Stud
22,1,,,19006,Kathleen Mccarthy; Kevin Moch; Kevin Moch,,Classics,10B,001,Credit,Non-Letter Grade,Pass,Intro Roman Civ
22,5,,,19014,Kim Shelton,,Classics,199,001,Credit,Non-Letter Grade,Pass,Superv Indep Stud
22,2,,,19202,Paul Li; Paul Li,,Cognitive Science,N1,001,Credit,Non-Letter Grade,Pass,Intro To Cog Sci
22,1,,,19208,Terrance Regier; Terrance Regier,,Cognitive Science,N1,004,Credit,Non-Letter Grade,Pass,Intro To Cog Sci
22,2,,,19212,Andrew Garrett; Oana David; Oana David,,Cognitive Science,C101,001,Credit,Non-Letter Grade,Pass,Mind And Language
22,5,,,19228,Paul Li; Paul Li,,Cognitive Science,199,004,Credit,Non-Letter Grade,Pass,Superv Indep Stud
22,14,,,19408,Elizabeth Williams; Elizabeth Williams,,College Writing Programs,N2,001,Credit,Non-Letter Grade,Pass,Wrtg The Bridge
22,12,,,19410,Kyle Livie; Kyle Livie,,College Writing Programs,N2,002,Credit,Non-Letter Grade,Pass,Wrtg The Bridge
22,13,,,19412,Benjamin Spanbock,,College Writing Programs,N2,003,Credit,Non-Letter Grade,Pass,Wrtg The Bridge
22,13,,,19414,Elizabeth Williams; Elizabeth Williams,,College Writing Programs,N2,004,Credit,Non-Letter Grade,Pass,Wrtg The Bridge
22,14,,,19418,Chisako Cole,,College Writing Programs,N2,006,Credit,Non-Letter Grade,Pass,Wrtg The Bridge
22,13,,,19420,Benjamin Spanbock,,College Writing Programs,N2,007,Credit,Non-Letter Grade,Pass,Wrtg The Bridge
22,1,,,19422,Daniel Husman; Daniel Husman,,College Writing Programs,R4A,001,Credit,Non-Letter Grade,Pass,Reading & Comp
22,2,,,19424,Jonathan Lang,,College Writing Programs,R4A,002,Credit,Non-Letter Grade,Pass,Reading & Comp
22,1,,,19428,David Frasca; Margi Wald,,College Writing Programs,5A,001,Credit,Non-Letter Grade,Pass,Engl Brdwy Musica
22,1,,,19436,Jeffrey Mcclelland; Margi Wald,,College Writing Programs,5C,004,Credit,Non-Letter Grade,Pass,Engl Thru Film
22,3,,,19440,Margi Wald; Nancy Hunt,,College Writing Programs,5D,001,Credit,Non-Letter Grade,Pass,Engl Thru Literat
22,1,,,19442,Margi Wald; Matthew Barclay,,College Writing Programs,5E,001,Credit,Non-Letter Grade,Pass,Engl Thru Pop Mus
22,1,,,19444,Margi Wald; Matthew Barclay,,College Writing Programs,5E,002,Credit,Non-Letter Grade,Pass,Engl Thru Pop Mus
22,2,,,19446,Carolyn Carr; Margi Wald,,College Writing Programs,5F,001,Credit,Non-Letter Grade,Pass,Engl Human Rights
22,1,,,19448,John Mcclain; Margi Wald,,College Writing Programs,5G,001,Credit,Non-Letter Grade,Pass,Engl Multicul Cal
22,1,,,19450,Carolyn Carr; Margi Wald,,College Writing Programs,5H,001,Credit,Non-Letter Grade,Pass,Engl Sustainabili
22,1,,,19454,Lincoln Davis; Margi Wald,,College Writing Programs,5I,002,Credit,Non-Letter Grade,Pass,Engl Tv Culture
22,1,,,19460,Margi Wald; Ruth Acker,,College Writing Programs,6A,003,Credit,Non-Letter Grade,Pass,Esl Acad Speaking
22,3,,,19466,Lawrence Metzger; Margi Wald,,College Writing Programs,6B,002,Credit,Non-Letter Grade,Pass,Esl Academic Voca
22,1,,,19468,Linda O'Roke; Margi Wald,,College Writing Programs,6C,001,Credit,Non-Letter Grade,Pass,Esl Business Voca
22,2,,,19474,Margi Wald; Mary Grover,,College Writing Programs,6E,002,Credit,Non-Letter Grade,Pass,Esl Grammar Editi
22,1,,,19476,Elizabeth Wadell; Elizabeth Wadell; Margi Wald,,College Writing Programs,6F,001,Credit,Non-Letter Grade,Pass,Esl Listen Speak
22,1,,,19480,Margi Wald; Ruth Acker,,College Writing Programs,6F,003,Credit,Non-Letter Grade,Pass,Esl Listen Speak
22,1,,,19486,Margi Wald; Michelle Baptiste,,College Writing Programs,6G,001,Credit,Non-Letter Grade,Pass,Esl Digital Writi
22,3,,,19496,Barrie Roberts; Margi Wald,,College Writing Programs,6I,002,Credit,Non-Letter Grade,Pass,Conflict Res Skil
22,1,,,19498,Amanda Fox; Margi Wald,,College Writing Programs,6J,001,Credit,Non-Letter Grade,Pass,Esl Test Prep
22,22,,,19508,Elizabeth Boner; Elizabeth Boner; Margi Wald,,College Writing Programs,7A,001,Credit,Non-Letter Grade,Pass,Amer Culture Medi
22,20,,,19510,Margi Wald; Michelle Sans,,College Writing Programs,7A,002,Credit,Non-Letter Grade,Pass,Amer Culture Medi
22,17,,,19512,Kathleen Mccarney; Margi Wald,,College Writing Programs,7A,003,Credit,Non-Letter Grade,Pass,Amer Culture Medi
22,17,,,19514,Margi Wald; Michael Clark,,College Writing Programs,7A,004,Credit,Non-Letter Grade,Pass,Amer Culture Medi
22,18,,,19518,Margi Wald; Thomas Mcnichol,,College Writing Programs,7B,001,Credit,Non-Letter Grade,Pass,Beat Generation
22,10,,,19520,Margi Wald; Thomas Mcnichol,,College Writing Programs,7B,002,Credit,Non-Letter Grade,Pass,Beat Generation
22,21,,,19530,Margi Wald; Peter Vahle,,College Writing Programs,7D,001,Credit,Non-Letter Grade,Pass,Food Culture
22,26,,,19532,Margi Wald; Peter Vahle,,College Writing Programs,7D,002,Credit,Non-Letter Grade,Pass,Food Culture
