3,5,,,39780,Bryan Brown; Bryan Brown; Lawrence Evans,,Mathematics,53,003,A,Letter Grade,A-,Multivar Calculus
3,4,,,39784,Cristian Mihai Munteanu; Lawrence Evans,,Mathematics,53,004,A,Letter Grade,A-,Multivar Calculus
3,1,,,39788,Calvin Mcphail-Snyder; Calvin Mcphail-Snyder; Lawrence Evans,,Mathematics,53,005,A,Letter Grade,A-,Multivar Calculus
3,1,,,39792,Kun Chen; Kun Chen; Lawrence Evans,,Mathematics,53,006,A,Letter Grade,A-,Multivar Calculus
3,30,,,39796,Michael Hutchings,,Mathematics,W53,001,A,Letter Grade,A-,Multivar Calculus
3,2,,,39800,Christopher Miller; Christopher Miller; Lawrence Evans,,Mathematics,54,001,A,Letter Grade,A-,Lin Alg & Diff
3,5,,,39804,Chiyu Jiang; Chiyu Jiang; Lawrence Evans,,Mathematics,54,002,A,Letter Grade,A-,Lin Alg & Diff
3,4,,,39808,Kyle Miller; Kyle Miller; Lawrence Evans,,Mathematics,54,003,A,Letter Grade,A-,Lin Alg & Diff
3,3,,,39812,Lawrence Evans; Ruochen Liang; Ruochen Liang,,Mathematics,54,004,A,Letter Grade,A-,Lin Alg & Diff
3,1,,,39816,Lawrence Evans; Onyebuchi Ekenta; Onyebuchi Ekenta,,Mathematics,54,005,A,Letter Grade,A-,Lin Alg & Diff
3,2,,,39820,Jason Ferguson; Jason Ferguson; Lawrence Evans,,Mathematics,54,006,A,Letter Grade,A-,Lin Alg & Diff
3,4,,,39824,Lawrence Evans; Michael Klug; Michael Klug,,Mathematics,54,007,A,Letter Grade,A-,Lin Alg & Diff
3,4,,,39828,Doosung Park; Doosung Park; Lawrence Evans,,Mathematics,54,008,A,Letter Grade,A-,Lin Alg & Diff
3,6,,,39832,Benjamin Castle; Benjamin Castle; Lawrence Evans,,Mathematics,55,001,A,Letter Grade,A-,Discrete Math
3,3,,,39836,Derek Hollowood; Derek Hollowood; Lawrence Evans,,Mathematics,55,002,A,Letter Grade,A-,Discrete Math
3,5,,,39840,Arash Farahmand,,Mathematics,55,003,A,Letter Grade,A-,Discrete Math
3,3,,,39844,Michael Wong; Michael Wong,,Mathematics,96,001,A,Letter Grade,A-,College Algebra
3,4,,,39892,Jonathan Gleason; Jonathan Gleason; Lawrence Evans,,Mathematics,104,001,A,Letter Grade,A-,Intro To Analysis
3,4,,,39896,Michael Pejic; Michael Pejic,,Mathematics,104,002,A,Letter Grade,A-,Intro To Analysis
3,1,,,39900,Khalilah Beal; Khalilah Beal,,Mathematics,104,003,A,Letter Grade,A-,Intro To Analysis
3,5,,,39904,Kai-Chieh Chen; Kai-Chieh Chen; Lawrence Evans,,Mathematics,110,001,A,Letter Grade,A-,Linear Algebra
3,5,,,39908,Brandon Williams; Brandon Williams; Lawrence Evans,,Mathematics,110,002,A,Letter Grade,A-,Linear Algebra
3,6,,,39912,James Mcivor; James Mcivor; Lawrence Evans,,Mathematics,113,001,A,Letter Grade,A-,Abstract Algebra
3,7,,,39916,Jesse Elliott; Jesse Elliott,,Mathematics,113,002,A,Letter Grade,A-,Abstract Algebra
3,6,,,39920,Lawrence Evans; Shiyu Li; Shiyu Li,,Mathematics,115,001,A,Letter Grade,A-,Intro Number Theory
3,2,,,39924,Kevin O'Neill; Kevin Oneill; Lawrence Evans,,Mathematics,126,001,A,Letter Grade,A-,Intro Part Dif Equa
3,7,,,39926,John Strain; John Strain,,Mathematics,128A,001,A,Letter Grade,A-,Numerical Analysis
3,7,,,39930,Chen Shen; Chen Shen; Lawrence Evans,,Mathematics,128A,002,A,Letter Grade,A-,Numerical Analysis
3,3,,,39934,Lawrence Evans; Samuel Ramsey; Samuel Ramsey,,Mathematics,185,001,A,Letter Grade,A-,Complex Analysis
3,6,,,39938,Albert Ai; Albert Ai; Lawrence Evans,,Mathematics,185,002,A,Letter Grade,A-,Complex Analysis
3,6,,,40136,James Robertson; James Robertson; Lawrence Evans,,Mathematics,10A,001,A,Letter Grade,A-,Methods Of Math
3,5,,,40502,Christopher Dames; Christopher Dames; Miguel Sierra Aznar; Miguel Sierra Aznar,,Mechanical Engineering,40,001,A,Letter Grade,A-,Thermodynamics
3,4,,,40506,Sanjay Govindjee,,Mechanical Engineering,W85,001,A,Letter Grade,A-,Intro Solid Mechn
3,2,,,40520,Oliver O'Reilly,,Mechanical Engineering,104,001,A,Letter Grade,A-,Engr Mechanics Ii
3,4,,,40524,Jocelyn Bale-Glickman; Jocelyn Bale-Glickman,,Mechanical Engineering,106,001,A,Letter Grade,A-,Fluid Mechanics
3,2,,,40534,David Rich; David Rich,,Mechanical Engineering,109,001,A,Letter Grade,A-,Heat Transfer
3,28,,,40538,Mark Martin,,Mechanical Engineering,110,001,A,Letter Grade,A-,Intro Product Dev
3,20,,,41402,Josh Jackson,,Media Studies,N10,001,A,Letter Grade,A-,Intro To Mediast
3,6,,,42702,Robin Ball; Robin Ball,,Molecular & Cell Biology,32,001,A,Letter Grade,A-,Intro Human Physi
3,8,,,42708,Robin Ball; Robin Ball,,Molecular & Cell Biology,32L,001,A,Letter Grade,A-,Int Human Phys La
3,9,,,42716,David Larue,,Molecular & Cell Biology,63,001,A,Letter Grade,A-,Intro Funct Neuro
3,4,,,42718,Natalia Caporale; Natalia Caporale,,Molecular & Cell Biology,C64,001,A,Letter Grade,A-,Exploring The Bra
3,16,,,42762,Natalia Caporale; Natalia Caporale,,Molecular & Cell Biology,102,001,A,Letter Grade,A-,Surv Biochem &
3,2,,,43402,Amalya Lehmann; Amalya Lehmann; Cindy Cox,,Music,20A,001,A,Letter Grade,A-,Basic Musicianship
3,2,,,43404,Cindy Cox; Margaret Jones; Margaret Jones,,Music,20A,002,A,Letter Grade,A-,Basic Musicianship
3,2,,,43406,Robert Yamasato; Robert Yamasato,,Music,20A,003,A,Letter Grade,A-,Basic Musicianship
3,8,,,43408,Merav Singer; Merav Singer,,Music,20A,004,A,Letter Grade,A-,Basic Musicianship
3,7,,,43410,Matthew Hough,,Music,20A,005,A,Letter Grade,A-,Basic Musicianship
3,4,,,43412,Cindy Cox; James Apgar; James Apgar,,Music,25A,001,A,Letter Grade,A-,Music Theory
3,3,,,43414,Cindy Cox; Ofer Gazit; Ofer Gazit,,Music,N26AC,001,A,Letter Grade,A-,Music In Amer Cul
3,2,,,43416,Cindy Cox; Elizabeth De Martelly; Elizabeth De Martelly,,Music,N26AC,002,A,Letter Grade,A-,Music In Amer Cul
3,1,,,43418,Edmund Campion,,Music,29,001,A,Letter Grade,A-,Music Now
3,1,,,43432,Jacqueline Chew,,Music,45A,001,A,Letter Grade,A-,Adv Beginning Piano
3,2,,,43444,Cindy Cox; Melanie Gudesblatt; Melanie Gudesblatt,,Music,128T,001,A,Letter Grade,A-,The Amer Musical
3,2,,,43446,Cindy Cox; Melanie Gudesblatt; Melanie Gudesblatt,,Music,128TM,001,A,Letter Grade,A-,The Amer Musical
3,1,,,43468,Doniel Wilson,,Music,143,001,A,Letter Grade,A-,Gospel Chorus
3,5,,,44102,Beth Piatote; Sonia Hart; Sonia Suarez,,Native American Studies,R1A,001,A,Letter Grade,A-,"Reading,Compositi"
3,7,,,44106,Sonia Hart; Sonia Suarez; Thomas Biolsi,,Native American Studies,R1A,002,A,Letter Grade,A-,"Reading,Compositi"
3,1,,,44110,Angela Aguilar; Angela Aguilar; Beth Piatote,,Native American Studies,R1B,001,A,Letter Grade,A-,"Reading,Compositi"
3,3,,,44114,Cynthia Ledesma; Cynthia Ledesma; Thomas Biolsi,,Native American Studies,R1B,002,A,Letter Grade,A-,"Reading,Compositi"
3,1,,,44120,Diane Pearson,,Native American Studies,151,001,A,Letter Grade,A-,Nat Amer Philos
3,4,,,44502,Aria Fani; Aria Fani; Carol Redmount,,Near Eastern Studies,R1A,001,A,Letter Grade,A-,Read Comp Ne Stud
3,6,,,44504,Carol Redmount; Roy Fisher; Roy Fisher,,Near Eastern Studies,R1A,002,A,Letter Grade,A-,Read Comp Ne Stud
3,1,,,44508,Terri-Lynn Tanaka; Terri-Lynn Tanaka,,Near Eastern Studies,C104,001,A,Letter Grade,A-,Babylonian Religi
3,7,,,45802,Greg Niemeyer; Nicholaus Gutierrez; Nicholaus Gutierrez,,New Media,R1B,001,A,Letter Grade,A-,New Media R&C
3,2,,,45804,Greg Niemeyer; Lark Buckingham; Megan Buckingham,,New Media,90,001,A,Letter Grade,A-,Intro New Media
3,21,,,46302,Nastaran Faghihnia; Nastaran Faghihnia,,Nutritional Science & Tox,10,001,A,Letter Grade,A-,Intro Human Nutr
3,39,,,46306,Nastaran Faghihnia; Nastaran Faghihnia,,Nutritional Science & Tox,10,002,A,Letter Grade,A-,Intro Human Nutr
3,4,,,47104,Tetsushi Ogata,,Peace & Conflict Studies,127,001,A,Letter Grade,A-,Hr And Global Poli
3,1,,,47108,Beth Roy; Beth Roy,,Peace & Conflict Studies,159,001,A,Letter Grade,A-,Con Res Intes Train
3,3,,,47302,Dylan Murray; Dylan Murray; Hannah Ginsborg,,Philosophy,2,001,A,Letter Grade,A-,Ind Moral/Soc Just
3,6,,,47306,Daniel Khokhar; Daniel Khokhar; Hannah Ginsborg,,Philosophy,2,002,A,Letter Grade,A-,Ind Moral/Soc Just
3,11,,,47309,Florian Grosser,,Philosophy,2,003,A,Letter Grade,A-,Ind Moral/Soc Just
3,1,,,47310,Alex Kerr; Alexander Kerr; John Macfarlane,,Philosophy,3,001,A,Letter Grade,A-,Nature Of Mind
3,4,,,47314,Adam Bradley; Adam Bradley; Hannah Ginsborg,,Philosophy,3,002,A,Letter Grade,A-,Nature Of Mind
3,2,,,47322,Hannah Ginsborg; Russell Buehler; Russell Buehler,,Philosophy,12A,001,A,Letter Grade,A-,Intro To Logic
3,3,,,47326,Ethan Jerzak; Ethan Jerzak; Hannah Ginsborg,,Philosophy,12A,002,A,Letter Grade,A-,Intro To Logic
3,4,,,47330,Hannah Ginsborg; Justin Vlasits; Justin Vlasits,,Philosophy,25A,001,A,Letter Grade,A-,Ancient Philosophy
3,4,,,47334,Hannah Ginsborg; Quinn Gibson; Quinn Gibson,,Philosophy,25A,002,A,Letter Grade,A-,Ancient Philosophy
3,2,,,47338,Timothy Crockett; Timothy Crockett,,Philosophy,25B,001,A,Letter Grade,A-,Modern Philosophy
3,1,,,47342,Timothy Crockett; Timothy Crockett,,Philosophy,25B,002,A,Letter Grade,A-,Modern Philosophy
3,1,,,47350,Paul Skokowski,,Philosophy,128,001,A,Letter Grade,A-,Phil Of Science
3,11,,,47354,Katrina Winzeler; Katrina Winzeler,,Philosophy,132,001,A,Letter Grade,A-,Philosophy Of Mind
3,5,,,47362,Klaus Corcilius,,Philosophy,160,001,A,Letter Grade,A-,Plato
3,2,,,47710,Sue Johannessen,,Physical Education,32,001,A,Letter Grade,A-,Fitness: Phs Ada/
3,4,,,48002,Matthias Reinsch; Matthias Reinsch,,Physics,7A,001,A,Letter Grade,A-,Scient Engin Phys
3,6,,,48020,Michael Bloxham,,Physics,7B,001,A,Letter Grade,A-,Scient Engin Phys
3,5,,,48038,Alex Frano Pereira,,Physics,7C,001,A,Letter Grade,A-,Scient Engin Phys
3,5,,,48052,William Golightly; William Golightly,,Physics,8A,001,A,Letter Grade,A-,Intro Physics
3,9,,,48090,Terrence Buehler; Terrence Buehler,,Physics,8B,001,A,Letter Grade,A-,Intro Physics
3,1,,,48123,Eric Hunter; Eric Hunter; Holger Mueller; Sylvia Lewin; Sylvia Lewin; Thomas Mittiga; Thomas Mittiga,,Physics,39,001,A,Letter Grade,A-,Low Div Phys Sem
3,1,,,48134,Amin Jazaeri,,Physics,77,001,A,Letter Grade,A-,Intro Comp Tech P
3,2,,,48140,Achilles Speliotopoulos; Achilles Speliotopoulos,,Physics,89,001,A,Letter Grade,A-,Intro To Math Phy
3,3,,,48148,Joseph Broz; Joseph Broz; Kevin Hayakawa; Kevin Hayakawa; Matthias Reinsch; Matthias Reinsch; Ryan Smith; Ryan Smith; Seth Hirsh,,Physics,111A,001,A,Letter Grade,A-,Instrumentation L
3,10,,,48152,Charles Wohl,,Physics,137A,001,A,Letter Grade,A-,Quantum Mechanics
3,1,,,48710,Kathleen Ryan,,Plant & Microbial Biology,C112,001,A,Letter Grade,A-,Gen Microbiology
3,4,,,49202,Stephanie Ballenger; Stephanie Ballenger,,Political Economy,100,001,A,Letter Grade,A-,Theory Of Pol Eco
3,15,,,49204,Fatmir Haskaj,,Political Economy,101,001,A,Letter Grade,A-,Contemp Theo Pol
3,12,,,49602,Eric Schickler; Jacob Grumbach; Jacob Grumbach,,Political Science,N1AC,001,A,Letter Grade,A-,Intro Amer Pol
3,2,,,49612,Eric Schickler; Tara Buss; Tara Buss,,Political Science,2,001,A,Letter Grade,A-,Intro Comparat Po
3,24,,,49622,Andrew Bertoli; Andrew Bertoli; Eric Schickler,,Political Science,3,001,A,Letter Grade,A-,Empirical Analysi
3,10,,,49642,Eric Schickler; Geoffrey Upton; Geoffrey Upton,,Political Science,116U,001,A,Letter Grade,A-,Topics Pol Theory
3,20,,,49652,Andrew Bertoli; Andrew Bertoli; Eric Schickler,,Political Science,123B,001,A,Letter Grade,A-,Topics Intntl Rel
3,13,,,49662,Michael Fish,,Political Science,129B,001,A,Letter Grade,A-,Russia After Comm
3,3,,,49672,Sean Gailmard,,Political Science,W135,001,A,Letter Grade,A-,Game Theory
3,10,,,49692,Mahmood Monshipouri,,Political Science,142A,001,A,Letter Grade,A-,Middle East Pol
3,14,,,49702,Pradeep Chhibber,,Political Science,W145A,001,A,Letter Grade,A-,Poli Dev India
3,26,,,49716,Eric Schickler; Susan Ostermann; Susan Ostermann,,Political Science,150,001,A,Letter Grade,A-,Amer Legal System
3,9,,,50202,Davina Chan; Davina Chan,,Psychology,N1,001,A,Letter Grade,A-,General Psychology
3,19,,,50204,John Kihlstrom,,Psychology,W1,001,A,Letter Grade,A-,General Psychology
3,11,,,50206,Robin Ball; Robin Ball,,Psychology,3,001,A,Letter Grade,A-,How The Brain Works
3,21,,,50208,Christopher Gade; Christopher Gade,,Psychology,6,001,A,Letter Grade,A-,Stress And Coping
3,21,,,50210,Arman Catterson; Arman Catterson,,Psychology,7,001,A,Letter Grade,A-,Person In Big Data
3,5,,,50258,Natalia Caporale; Natalia Caporale,,Psychology,C64,001,A,Letter Grade,A-,Exploring The Brain
3,1,,,50282,Arman Catterson; Arman Catterson,,Psychology,101,001,A,Letter Grade,A-,Res & Data Anal
3,6,,,50292,Davina Chan; Davina Chan,,Psychology,N110,001,A,Letter Grade,A-,Introd Biol Psych
3,2,,,50296,James Mc Hale; James Mchale,,Psychology,N130,001,A,Letter Grade,A-,Clinical Psychology
3,3,,,50298,Aaron Fisher,,Psychology,N134,001,A,Letter Grade,A-,Health Psychology
3,3,,,50300,Ephrem Fernandez,,Psychology,N135,001,A,Letter Grade,A-,Treating Mental Ill
3,4,,,50302,James Mc Hale; James Mchale,,Psychology,136,001,A,Letter Grade,A-,Human Sexuality
3,8,,,50304,Ephrem Fernandez,,Psychology,139,001,A,Letter Grade,A-,Clinical Case Study
3,6,,,50306,Amy Strage; Amy Strage,,Psychology,N140,001,A,Letter Grade,A-,Development Psych
3,15,,,50308,Amy Cook; Amy Cook,,Psychology,N140,002,A,Letter Grade,A-,Development Psych
3,10,,,50310,Oliver John,,Psychology,N150,001,A,Letter Grade,A-,Personality Psych
3,18,,,50312,Christopher Gade; Christopher Gade,,Psychology,N160,001,A,Letter Grade,A-,Social Psychology
3,14,,,50314,Shreya Sarkar-Barney,,Psychology,N180,001,A,Letter Grade,A-,Indust/Organ Psych
3,24,,,50706,Maureen Lahiff,,Public Health,141,001,A,Letter Grade,A-,Intro Biostat
3,18,,,50716,Robin Flagg; Robin Flagg,,Public Health,150D,001,A,Letter Grade,A-,Intro Hlth Pol Mg
3,2,,,50717,Joshua Seim; Joshua Seim,,Public Health,C155,001,A,Letter Grade,A-,Soc Of Hlth & M
3,3,,,50718,Peter Dailey; Peter Dailey,,Public Health,162A,001,A,Letter Grade,A-,Pub Hlth Microbio
3,4,,,50872,Sarah Gamble,,Public Health,107,001,A,Letter Grade,A-,Viol Soc Jst Pb H
3,1,,,51202,Jeffery Greenblatt,,Public Policy,C184,001,A,Letter Grade,A-,"Energy, Society"
3,2,,,51602,Terri-Lynn Tanaka; Terri-Lynn Tanaka,,Religious Studies,C104,001,A,Letter Grade,A-,Babylonian Religi
3,1,,,51604,Matteo Bortolini,,Religious Studies,C182,001,A,Letter Grade,A-,Sociology Religio
3,9,,,51802,Michael Mascuch; Michael Mascuch; Richard Grijalva; Richard Grijalva,,Rhetoric,R1B,001,A,Letter Grade,A-,Craft Of Writing
3,2,,,51804,Michael Dalebout; Michael Dalebout; Michael Mascuch; Michael Mascuch,,Rhetoric,2,001,A,Letter Grade,A-,Public Speaking
3,4,,,51806,Dale Carrico; Norman Carrico,,Rhetoric,10,001,A,Letter Grade,A-,Reason And Argument
3,3,,,51824,Jerilyn Sambrooke; Jerilyn Sambrooke; Michael Mascuch; Michael Mascuch,,Rhetoric,156,001,A,Letter Grade,A-,Political Novel
3,3,,,52302,Ida Johnson; Ida Johnson; Karin Sanders,,Scandinavian,R5B,001,A,Letter Grade,A-,Reading & Comp
3,8,,,52304,Monica Hidalgo; Monica Hidalgo,,Scandinavian,R5B,101,A,Letter Grade,A-,Reading & Comp
3,3,,,52306,Monica Hidalgo; Monica Hidalgo,,Scandinavian,R5B,102,A,Letter Grade,A-,Reading & Comp
3,3,,,52308,Jackson Crawford,,Scandinavian,160,001,A,Letter Grade,A-,Scandin Myth & Re
3,2,,,53602,Lyubov Golburt; Lyubov Golburt; Thomas Dyne; Thomas Dyne,,Slavic Languages & Lit,R5B,001,A,Letter Grade,A-,Reading And Comp
3,8,,,53604,Lyubov Golburt; Lyubov Golburt; Matthew Kendall; Matthew Kendall,,Slavic Languages & Lit,R5B,101,A,Letter Grade,A-,Reading And Comp
3,4,,,54910,Veronica Piper-Jefferson,,Social Welfare,105,001,A,Letter Grade,A-,Intro Chld Welf
3,9,,,54912,Christina Feliciana; Christina Feliciana,,Social Welfare,110,001,A,Letter Grade,A-,Soc Wk As A Prof
3,11,,,54918,Genevieve Graaf; Genevieve Graaf; Hanna Mark; Hanna Mark; Jill Berrick; Jill Duerr,,Social Welfare,112,001,A,Letter Grade,A-,Soc Welfare Polic
3,11,,,54924,Reiko Boyd; Reiko Boyd,,Social Welfare,114,001,A,Letter Grade,A-,Practice In Soc W
3,2,,,54932,Amanda Reiman; Amanda Reiman,,Social Welfare,148,001,A,Letter Grade,A-,Sub Abuse Trmt
3,1,,,54934,Alexandra Lutnick; Alexandra Lutnick,,Social Welfare,150L,001,A,Letter Grade,A-,Soc Wk & Sexualit
3,4,,,54940,Jennifer Jackson,,Social Welfare,186,001,A,Letter Grade,A-,Domestic Violence
3,4,,,55501,Laura Thomson,,Sociology,N1H,001,A,Letter Grade,A-,Intro To Sociology
3,7,,,55502,Kristen Nelson; Kristen Nelson; Michael Burawoy,,Sociology,3AC,001,A,Letter Grade,A-,Prin Soc: Am Cultur
3,12,,,55504,James Lamb; James Lamb; Michael Burawoy,,Sociology,5,001,A,Letter Grade,A-,Eval Of Evidence
3,1,,,55510,Linus Huang; Linus Huang,,Sociology,110,001,A,Letter Grade,A-,Org & Soc Insti
3,9,,,55512,Mario Castillo; Mario Castillo; Michael Burawoy,,Sociology,111AC,001,A,Letter Grade,A-,Socio Of The Family
3,1,,,55514,Matteo Bortolini,,Sociology,C112,001,A,Letter Grade,A-,Sociology Religion
3,4,,,55516,Fithawee Tzeggai; Fithawee Tzeggai; Michael Burawoy,,Sociology,113AC,001,A,Letter Grade,A-,Education
3,6,,,55517,Joshua Seim; Joshua Seim; Michael Burawoy,,Sociology,C115,001,A,Letter Grade,A-,Soc Of Hlth & M
3,2,,,55518,John Kaiser; John Kaiser,,Sociology,130,001,A,Letter Grade,A-,Soc Inequalities
3,6,,,55520,Andrew Barlow,,Sociology,131AC,001,A,Letter Grade,A-,Race/Eth Rel:Am Cul
3,12,,,55522,Laleh Behbehanian; Laleh Behbehanian,,Sociology,140,001,A,Letter Grade,A-,Polit & Soc Cha
3,15,,,55524,Brian Powers; Brian Powers,,Sociology,150,001,A,Letter Grade,A-,Social Psych
3,5,,,55526,Matthew Rowe; Matthew Rowe; Michael Burawoy,,Sociology,160,001,A,Letter Grade,A-,Sociol Of Culture
3,5,,,55528,Edwin Lin; Edwin Lin,,Sociology,167,001,A,Letter Grade,A-,Virtual Communities
3,2,,,55530,Edwin Ackerman; Edwin Ackerman; Michael Burawoy,,Sociology,190,001,A,Letter Grade,A-,Sem & Res In So
3,4,,,56204,Padma Maitland; Padma Maitland; Robert Goldman,,South Asian,R5A,002,A,Letter Grade,A-,Great Books India
3,1,,,56210,Luis Gonzalez-Reimann; Luis Gonzalez-Reimann,,South Asian,140,001,A,Letter Grade,A-,Hindu Mythology
3,1,,,58202,Kyle Thomson; Kyle Thomson; Miriam Hernandez-Rodriguez,,Spanish,1,001,A,Letter Grade,A-,Elem Spanish
3,4,,,58204,Caterina Riley; Caterina Riley; Miriam Hernandez-Rodriguez,,Spanish,1,002,A,Letter Grade,A-,Elem Spanish
3,1,,,58207,Azucena Hernandez-Ramirez; Azucena Hernandez-Ramirez; Miriam Hernandez-Rodriguez,,Spanish,3,001,A,Letter Grade,A-,Intermed Spanish
3,4,,,58210,Daniel Rodriguez; Daniel Rodriguez; Miriam Hernandez-Rodriguez,,Spanish,4,001,A,Letter Grade,A-,Intermed Spanish
3,1,,,58212,Ignacio Navarrete; Victoria Robertson,,Spanish,N4,001,A,Letter Grade,A-,Intermed Spanish
3,2,,,58218,Camilo Jaramillo; Camilo Jaramillo Castrillon; Estelle Tarica,,Spanish,102A,001,A,Letter Grade,A-,Adv Gram And Comp
3,5,,,58222,Ignacio Navarrete; Maria Fernandez-Vega; Maria Fernandez-Vega,,Spanish,121,001,A,Letter Grade,A-,Cont Span Hist/Cu
3,2,,,58226,Elizabeth Spragins,,Spanish,135,001,A,Letter Grade,A-,Hispanic Literatu
3,3,,,58228,Flor Lopez; Flor Lopez Malagamba; Natalia Brizuela,,Spanish,135,002,A,Letter Grade,A-,Hispanic Literatu
3,14,,,58712,Seema Singh Saharan,,Statistics,2,001,A,Letter Grade,A-,Intro To Stat
3,5,,,58720,Fletcher Ibser; Fletcher Ibser,,Statistics,20,001,A,Letter Grade,A-,Intro Prob Stat Cal
3,18,,,58726,Fletcher Ibser; Fletcher Ibser,,Statistics,W21,001,A,Letter Grade,A-,Intro Prob Stat Bus
3,6,,,58738,Michael Jordan; Thanh-Nhan Do; Thanh-Nhan Do,,Statistics,133,001,A,Letter Grade,A-,Computing Data
3,4,,,58742,Michael Jordan; Wenpin Tang; Wenpin Tang,,Statistics,134,001,A,Letter Grade,A-,Concepts Of Prob
3,11,,,58750,Seema Singh Saharan,,Statistics,135,001,A,Letter Grade,A-,Concepts Of Stat
3,7,,,58756,Hyunyoung Choi,,Statistics,155,001,A,Letter Grade,A-,Game Theory
3,3,,,59510,John Fisher; John Fisher,,Theater Dance & Perf Stds,10,002,A,Letter Grade,A-,Fund. Of Acting I
3,4,,,59512,Maureen Tang; Maureen Tang,,Theater Dance & Perf Stds,10,003,A,Letter Grade,A-,Fund. Of Acting I
3,2,,,59516,Jenefer Johnson,,Theater Dance & Perf Stds,52AC,001,A,Letter Grade,A-,Dance In Am Cultu
3,6,,,59520,Joy Christine Nicholson,,Theater Dance & Perf Stds,113A,001,A,Letter Grade,A-,Irish Theater
3,1,,,59522,Maureen Tang; Maureen Tang,,Theater Dance & Perf Stds,114,001,A,Letter Grade,A-,Performance Wrksh
3,3,,,59524,Michael Mansfield,,Theater Dance & Perf Stds,114,002,A,Letter Grade,A-,Performance Wrksh
3,5,,,59526,Sean San Jose,,Theater Dance & Perf Stds,114,003,A,Letter Grade,A-,Performance Wrksh
3,4,,,59528,Jessica Hirigoyen,,Theater Dance & Perf Stds,114,004,A,Letter Grade,A-,Performance Wrksh
3,9,,,59530,Abigail De Kosnik; Christian Nagler; Christian Nagler; Takeo Rivera; Takeo Rivera,,Theater Dance & Perf Stds,118AC,001,A,Letter Grade,A-,"Perf, Tv, Soc Med"
3,2,,,59802,Marlo Warburton; Marlo Warburton,,UGIS-UG Interdisc Studies,82,001,A,Letter Grade,A-,K-8 Teaching
3,1,,,59803,Jeroen Dewulf,,UGIS-UG Interdisc Studies,W158,001,A,Letter Grade,A-,Global Citizenship
3,3,,,59812,Jeroen Dewulf,,UGIS-UG Interdisc Studies,W158,003,A,Letter Grade,A-,Global Citizenship
3,3,,,59814,Jeroen Dewulf,,UGIS-UG Interdisc Studies,W158,004,A,Letter Grade,A-,Global Citizenship
3,2,,,59818,Jeroen Dewulf,,UGIS-UG Interdisc Studies,W158,006,A,Letter Grade,A-,Global Citizenship
3,1,,,59822,Jeroen Dewulf,,UGIS-UG Interdisc Studies,W158,008,A,Letter Grade,A-,Global Citizenship
3,1,,,59826,Jeroen Dewulf,,UGIS-UG Interdisc Studies,W158,010,A,Letter Grade,A-,Global Citizenship
3,4,,,59830,Joel Clark,,UGIS-UG Interdisc Studies,W157,001,A,Letter Grade,A-,Experiential Learn
3,3,,,59836,Joel Clark,,UGIS-UG Interdisc Studies,W157,004,A,Letter Grade,A-,Experiential Learn
3,2,,,59840,Joel Clark,,UGIS-UG Interdisc Studies,W157,006,A,Letter Grade,A-,Experiential Learn
3,4,,,59844,Joel Clark,,UGIS-UG Interdisc Studies,W157,008,A,Letter Grade,A-,Experiential Learn
3,1,,,59846,Joel Clark,,UGIS-UG Interdisc Studies,W157,009,A,Letter Grade,A-,Experiential Learn
3,7,,,59848,Joel Clark,,UGIS-UG Interdisc Studies,W157,010,A,Letter Grade,A-,Experiential Learn
3,8,,,59852,Joel Clark,,UGIS-UG Interdisc Studies,W157,012,A,Letter Grade,A-,Experiential Learn
3,3,,,59854,Joel Clark,,UGIS-UG Interdisc Studies,W157,013,A,Letter Grade,A-,Experiential Learn
4,2,,,10102,Leigh Raiford; Selina Makana; Selina Makana,,African American Studies,R1B,001,B,Letter Grade,B+,Freshmn Compositi
4,4,,,10106,Aparajita Nanda,,African American Studies,R1B,002,B,Letter Grade,B+,Freshmn Compositi
4,1,,,10116,Cara Stanley; Cara Stanley; Leigh Raiford,,African American Studies,39D,002,B,Letter Grade,B+,Fresh/Soph Semina
4,4,,,10118,Leigh Raiford; Patrick Johnson; Patrick Johnson,,African American Studies,39E,001,B,Letter Grade,B+,Fresh/Soph Semina
4,4,,,10122,Stephen Small; Stephen Small,,African American Studies,W111,001,B,Letter Grade,B+,"Race, Class & Gen"
4,2,,,10124,Justin Gomer; Justin Gomer,,African American Studies,119,001,B,Letter Grade,B+,Selected Topics
4,1,,,10132,Amani Morrison; Amani Morrison; Leigh Raiford,,African American Studies,159,002,B,Letter Grade,B+,Spec Top Afam Lit
4,3,,,10134,Ameer Loggins; Ameer Loggins; Leigh Raiford,,African American Studies,159,003,B,Letter Grade,B+,Spec Top Afam Lit
4,1,,,11022,Kathleen Moran,,American Studies,5,002,B,Letter Grade,B+,Keywords Amer Std
4,2,,,11402,Ashley Lipps; Ashley Lipps,,Anthropology,1,001,B,Letter Grade,B+,Intro To Bio Anthro
4,1,,,11412,Kimberly Christensen; Kimberly Christensen,,Anthropology,2AC,001,B,Letter Grade,B+,Intro Archaeology
4,4,,,11420,M. George; Mary Mather George,,Anthropology,3AC,001,B,Letter Grade,B+,Intro Soc/Cult Ac
4,1,,,11432,Laurie Wilkie; Milad Odabaei; Milad Odabaei,,Anthropology,R5B,002,B,Letter Grade,B+,Reading & Comp
4,3,,,11436,Ian Steele; Ian Steele; Laurie Wilkie,,Anthropology,R5B,004,B,Letter Grade,B+,Reading & Comp
4,1,,,11446,Christopher Roebuck; Christopher Roebuck,,Anthropology,115,001,B,Letter Grade,B+,Intro Med Anthro
4,2,,,11452,Katharine Young,,Anthropology,119,001,B,Letter Grade,B+,Med Anthro Topics
4,4,,,11454,Jillian Swift; Jillian Swift,,Anthropology,128M,001,B,Letter Grade,B+,Topics:Arch/Method
4,1,,,11456,Brian Karl,,Anthropology,166,001,B,Letter Grade,B+,"Lang,Culture,Socity"
4,1,,,11902,Soufiane Soleimane Chami,,Arabic,10,001,B,Letter Grade,B+,Intens Elem Arabic
4,2,,,12001,Darell Fields,,Architecture,11A,001,B,Letter Grade,B+,Intro Vis Rep Draw
4,6,,,12002,Mark Schatz,,Architecture,108,001,B,Letter Grade,B+,Arch Internship
4,1,,,12006,Joris Komen; Joris Komen,,Architecture,124A,001,B,Letter Grade,B+,3-D Computer Tech
4,1,,,12008,Joris Komen; Joris Komen,,Architecture,124A,002,B,Letter Grade,B+,3-D Computer Tech
4,1,,,12010,Luis Jaggy; Luis Jaggy,,Architecture,124B,002,B,Letter Grade,B+,3-D Computer Tech
4,2,,,12302,Jose Figueroa; Jose Figueroa,,Art Practice,8,001,B,Letter Grade,B+,Intro Vis Thinking
4,1,,,12312,Aida Gamez; Aida Gamez,,Art Practice,12,002,B,Letter Grade,B+,Lang Of Draw
4,2,,,12314,Azin Seraj; Azin Seraj,,Art Practice,21,001,B,Letter Grade,B+,Digital Photography
4,4,,,12324,Jenifer Wofford; Jenifer Wofford,,Art Practice,119,001,B,Letter Grade,B+,Gpca
4,2,,,12602,Gregory Levine; Sharone Tomer; Sharone Tomer,,History of Art,R1B,001,B,Letter Grade,B+,Visual Experience
4,3,,,12604,Gregory Levine; Matthew Culler; Matthew Culler,,History of Art,R1B,002,B,Letter Grade,B+,Visual Experience
4,1,,,12606,Elaine Yau; Elaine Yau; Gregory Levine,,History of Art,108,001,B,Letter Grade,B+,Cities And The Ar
4,1,,,12608,Gregory Levine; Sarah Cowan; Sarah Cowan,,History of Art,N182,001,B,Letter Grade,B+,Hist Of Photograp
4,2,,,12610,Emma Silverman; Emma Silverman; Gregory Levine,,History of Art,187AC,001,B,Letter Grade,B+,American Art/Ac
4,3,,,12902,Anna Leong; Anna Leong; Ariko Ikehara; Ariko Ikehara,,Asian American Studies,R2A,002,B,Letter Grade,B+,Reading&Composition
4,4,,,12906,Khuyen Nguyen; Khuyen Nguyen,,Asian American Studies,R2A,003,B,Letter Grade,B+,Reading&Composition
4,1,,,12918,Thomas Fleming,,Asian American Studies,141,001,B,Letter Grade,B+,Law In Asam Commun
4,8,,,13302,Bryan Mendez; Bryan Mendez; Steven Beckwith,,Astronomy,9,001,B,Letter Grade,B+,Select Topics Astro
4,3,,,13304,Gaspard Duchene,,Astronomy,10,001,B,Letter Grade,B+,General Astronomy
